,source,page,date,title,body,tokenized,action,pair,duration
169,fxstreet,6,2022-05-24,Silver Price Forecast XAG/USD climbs steadily and tests the $22.00 mark,silver xag/usd registers gains but appears to be glued to the $22.00 mark as xag/usd bulls failed to record a daily close above the $22.00 area for four consecutive days albeit a dampened market mood. at the time of writing the xag/usd is trading at $22.05.us equities keep illustrating a dampened market mood in tone with the asian and european sessions. s&p global pmis revealed that europe and the us presented mixed results increasing investors’ concerns that europe and the us might suffer a  possible economic slowdown. the supply chain issues continue and higher costs from raw materials would keep inflationary pressures elevated.given the backdrop that the federal reserve is tightening monetary conditions in the us and is about to hike 50-bps in the june and july meetings concerns about the us central bank achieving a soft or “softish landing” as fed chair powell said look far to be done. that’s why market players keep the us stock market downward pressured and the us dollar softer.the us dollar index a gauge of the greenback’s value against a basket of its rivals slides 0.24 and is down at 101.850. failure to reclaim the 102.000 mark would open the door for a retest of april 21 swing low at 99.818. on the same note the 10-year us treasury yield grinds lower and loses almost ten basis points bps sitting at 2.761 a tailwind for silver prices.elsewhere atlanta’s fed president raphael bostic crossed the wires though he sounded less “hawkish” than usually. bostic said that rate hikes won’t cause a recession and that the central bank can hike rates to deal with overly high inflation without sending the us economy into recession. he stated that the us central bank could pause rate increases in september to review how the economy performs.macroeconomic-wise the us docket featured the us s&p global pmis for may which illustrated mixed results with the services and composite indexes missing expectations while the manufacturing pmi was unchanged. furthermore richmond’s fed manufacturing index plunged to -14 vs. 15 foreseen adding to the fed regional manufacturing reports showing deceleration or contraction.xag/usd is still downward biased despite recording gains for the third day out of the last four. however it’s important that xag/usd traders need to be aware that silver has struggled at the $22.00 mark. failure at the previously mentioned would resume the downtrend and open the door for further losses.if that scenario plays out the xag/usd’s first support would be the may 19 pivot low at $21.28. break below would expose the may 16 daily low at $20.84 followed by the ytd low at $20.45. however if xag/usd’s bulls accomplish a daily close above the $22.00 mark that could allow further gains. the xag/usd first resistance would be the psychological $23.00 mark. once cleared the next supply zones would be the may 5 swing high at $23.28 followed by a test of the 200-dma at $23.57.  ,"['silver', 'price', 'forecast', 'xag/usd', 'climb', 'steadily', 'test', '$', '22.00', 'mark']",bull,[],fivemin_counter
170,fxstreet,6,2022-05-24,EUR/USD Price Analysis Bulls charge towards a critical weekly 50 mean reversion mile-stone,as per the start of the week's analysis eur/usd price analysis bulls are taking over through key daily resistance the price has continued higher as the bulls hunt down key weekly resistance structure. breaking daily resistance in the opening sessions on monday eur/usd breached the 38.2 fibonacci of the weekly bearish impulse on monday and has subsequently moved higher into the 1.07 areas with eyes on mid-late april daily swing lows near 1.0770. the following illustrates the bullish bias over a series of time frames. it was stated that ''the bulls are already penetrating the 38.2 fibonacci and on the way to 1.07 the figure. a move towards the 50 and 61.8 ratios could be on the cards for the foreseeable future.''as for the daily chart the analysis noted ''the price imbalance on the daily chart leaves the aforementioned weekly ratios on the fibonacci scale exposed towards 1.0770 and 1.0936.''the price is moving in on the aforementioned weekly supply zone and prior daily swing lowshowever at this juncture the weekly w-formation should be notedthis is a reversion pattern and the price would be expected to revisit the neckline in due course. in the meantime the daily impulse could be due for a meanwhile correction alsothe bearish head and shoulders are a topping pattern that currently features in the 15-min time frame. a break of the neckline near 1.0725 could spell trouble for the committed bulls. a break of 1.0705 will likely open the way for further supply to mitigate the price imbalance towards a 38.2 fibonacci retracement of the daily bullish breakout impulse near 1.0665 that guards a 50 mean reversion to 1.0640. ,"['eur/usd', 'price', 'analysis', 'bull', 'charge', 'towards', 'critical', 'weekly', '50', 'mean', 'reversion', 'mile-stone']",na,eur/usd,fivemin_counter
171,fxstreet,7,2022-05-24,GBP/USD Price Analysis Faces a wall of resistance around 1.2600 and retraces towards 1.2530s,the british pound shifted to the defensive as sentiment shifted sour and weighed by weaker than expected uk pmis which dragged the major from weekly highs at around 1.2600 towards the 1.2530s area. at 1.2536 the gbp/usd is trimming some of monday’s gains and is down 0.40.the mood remains dampened spurred by concerns about the us economy falling into a recession. the federal reserve is on a hiking cycle tightening its monetary policy which according to money market futures would see the fed hiking towards the 2.75-3 area by the end of the year.another factor that is weighing on is china’s covid-19 crisis. reports over the weekend illustrated that beijing is struggling to cap the spread. meanwhile shanghai which was about to lift restrictions witnessed another outbreak though not as at the beginning of the last episode.elsewhere the gbp/usd opened near the daily high around 1.2600 but fell and broke below the central and s1 daily pivot points near the 1.2480s. nevertheless towards the end of the european session the major is treading water and is aiming towards the 50-hour simple moving average sma at 1.2542.from a technical perspective the gbp/usd remains downward biased despite bouncing 300 pips from the ytd low to current levels. the 1.2600 mark probes to be a solid resistance as the gbp/usd bulls struggled twice to reclaim the figure which would have opened the door for an upward move towards the may 4 swing high at 1.2638. however a daily close below 1.2600 would leave the pair vulnerable to additional selling pressure further validated by the rsi at 48.69 within the negative territory and aiming lower.that said the gbp/usd first support would be the psychological 1.2500 figure. a breach of the latter would expose july 2020 lows near 1.2479 followed by the may 17 daily low at 1.2313 and the ytd low at 1.2155.  ,"['gbp/usd', 'price', 'analysis', 'face', 'wall', 'resistance', 'around', '1.2600', 'retrace', 'towards', '1.2530s']",na,gbp/usd,fivemin_counter
172,fxstreet,7,2022-05-24,AUD/USD is sliding as investors rethink the macro outlook,at 0.7085 aud/usd is trading down some 0.31 sliding from a high of 0.7107 to a low of 0.7056.  the australian dollar eased on tuesday as global stocks underperformed while investors remain concerned over china's economy and covid lockdowns. at the start of the week traders favoured the pledges of more stimulus from china's government over the prospects of a prolonged lockdown in various regions of the nation that still struggles with the pandemic. the government's dynamic zero-covid policy will remain in place through 2022 preventing a return to normalcy and limiting the effectiveness of new fiscal and monetary stimulus measures warned s&p global. thus real gdp growth will likely slow from 8.1 in 2021 to 4.3 in 2022. new geopolitical financial or supply-side shocks could tip the world economy into recession.meanwhile with central banks in the picture the us dollar's appeal has been hit due to other central bankers speaking out and carrying hawkish rhetoric.  the dxy index which measures a basket of currencies vs. the us dollar printed a fresh one-month low on tuesday after european central bank president christine lagarde said eurozone interest rates will likely be in positive territory by the end of the third quarter. this supported the euro in a correction higher and weighed on the greenback. as for the reserve bank of australia consumer spending seems to have held up well to the reserve bank of australia's rba first hike in interest rates earlier this month. however some of the data of late may not have met the mark. ''the wage price index wpi came in below expectations in the first quarter at a low 0.7 qoq 0.65 the same rate as in the fourth quarter 2021'' analysts at anz bank explained adding that ''this suggests the rba is likely to hike the cash rate another 25bp in june rather than a larger 40 or 50bp hike.''''the wage and employment data hasn’t in our view met governor lowe’s threshold of there needing to be “a very strong argument” for the rba to “deviate” from moves of 25bp in coming months.''''especially when the minutes from the may meeting highlighted that the board meets monthly so has the opportunity to review the setting of interest rates again within a relatively short period of time.''meanwhile markets are priced for quarter-point rises in the 0.35 cash rate in both june and july and a half-point hike in august following what is likely to be another alarming inflation report.looking ahead the rba assistant governor luci ellis is due to speak and could expand on the central bank's own outlook for policy.  ,"['aud/usd', 'slide', 'investors', 'rethink', 'macro', 'outlook']",bear,aud/usd,fivemin_counter
173,fxstreet,7,2022-05-24,Gold Price Forecast XAU/USD climbs and keeps above the 20-DMA around $1860s,gold spot xau/usd records solid gains and stays above the 20-day moving average dma which lies at $1854.50 amidst a dismal market sentiment falling us treasury yields and a weaker us dollar. at $1867.22 xau/usd eyes to re-test the march 31 swing low-turned-resistance at around $1889.91.risk-aversion keeps riskier assets under pressure. global equities are recording losses while the non-yielding metal has seen an increase in flows towards its safe-haven status while the greenback keeps tumbling a tailwind for gold prices. the us dollar index a gauge of the buck’s value vs. a basket of peers is falling 0.36 down at 101.717.investors’ concerns that the us federal reserve would trigger a recession in favor of bringing inflation down weighed on the market mood. additionally china’s ongoing coronavirus crisis keeps the global economic outlook cloudy. according to the global times shanghai will allow convenience stores and drugstores to resume operations with a maximum occupancy of 50 before may 31 and 75 after june 1.in the meantime us treasuries keep plunging led by the 10-year treasury yield down 11 bps sitting at 2.743.at the time of writing atlanta’s fed president raphael bostic hit the wires. bostic said he supports expeditious rate hikes to neutral but done  “with intention and without recklessness.” further added that he does not see clear signs of a wage-price spiral.the us economic docket featured the us s&p global pmis for may which illustrated mixed results with the services and composite indexes missing expectations while the manufacturing pmi was unchanged. furthermore richmond’s fed manufacturing index plunged to -14 vs. 15 foreseen adding to the fed regional manufacturing reports showing deceleration or contraction.xau/usd remains neutral biased despite exchanging hands above the 20 and the 200-day moving averages dmas each at $1854.41 and $1839.36 respectively. the four-consecutive day rally continued but the non-yielding metal will face substantial resistance levels around the 100-dma and march’s 31 swing lows. if xau/usd fails to reclaim the previously mentioned levels gold would aim south and re-test the 200-dma.upwards the xau/usd’s first resistance would be the 100-dma at 1886.84. break above would immediately expose the march 31 swing low-turned-resistance at 1889.91 followed by the 1900 mark. on the flip side the xau/usd’s first support would be the 20-dma at $1854.41 followed by the 200-dma at $1839.36 and then the $1800 figure.  ,"['gold', 'price', 'forecast', 'xau/usd', 'climb', 'keep', '20-dma', 'around', '$', '1860s']",bull,[],fivemin_counter
174,fxstreet,7,2022-05-24,Fed's Bostic Fed might need to pause rate increases in September,federal reserve's raphael bostic said rate hikes won’t cause a recession and that the central bank can hike rates to deal with overly high inflation without sending the us economy into recession.he repeats that the fed rates hikes can take some pause arguing that the fed might need to pause rate increases in september to take stock of how the economy is performing.will proceed 'with intention without recklessness'.monetary policymakers must be mindful of uncertainties proceed carefully in tightening policy.the bruised us dollar was sold off to a fresh one-month low on tuesday. against a basket of its rivals dxy the dollar fell to 101.646 its lowest level since april 25. ,"['feed', ""'s"", 'bostic', 'feed', 'might', 'need', 'pause', 'rate', 'increase', 'september']",na,[],fivemin_counter
175,fxstreet,7,2022-05-24,USD/JPY drops to one-month lows near 126.30 as US yields fall further,the usd/jpy ended with days of consolidation with a sharp decline on tuesday. the pair broke under 127.00 and tumbled to 126.34 the lowest level in a month. it remains near the lows under pressure amid risk aversion.the decline of usd/jpy gained momentum on the back of a weaker us dollar lower yields and as stocks in wall street turned red. the dow jones is falling 0.83 and the nasdaq drops by 2.78. the us 10-year yield stands at 2.73 a four-week low while the 30-year is back under 3.economic data from the us came in below expectations pmis and new home sales and weighed on the greenback. the dxy is falling 0.37 trading at 101.70 the lowest in almost a month.analysts at mufg bank see the usd/jpy pair with a bearish bias moving in the range 122.00/129.50 during the next weeks.  “the main risk to our bearish outlook for usd/jpy would be if global growth concerns eased in the month ahead. a pick-up in china growth could be one potential trigger. the upward impact on global yields commodity prices and a potential stabilization for global equity markets should encourage a higher usd/jpy even if the usd weakens more broadly. yen weakness would be more evident though against high beta commodity currencies.”if the usd/jpy extends the decline below the 126.30 support line 126.00 is the next target followed by 125.75 april 11 12 high. a recovery now would face an immediate resistance at the 127.00/05 area. above the next one might be seen at 127.60 and then comes a downtrend line at 128.30.  ,"['usd/jpy', 'drop', 'one-month', 'low', 'near', '126.30', 'us', 'yield', 'fall']",bear,usd/jpy,fivemin_counter
176,fxstreet,7,2022-05-24,EUR/USD Neutral bias to move in the 1.03/1.11 range – MUFG,a break lower in the eur/usd pair to new lows remains plausible in a scenario of tighter financial conditions explain analysts at mufg bank. they point out the scale of the sell-off of the dollar does highlight the limits to the bull-run from here and with so much federal reserve tightening priced they still expect the us dollar to weaken more notably later in the year.“we are sticking to our neutral bias for eur/usd in the month ahead. the ecb’s recent hawkish policy shift has helped to provide some much-needed support for the eur after it briefly tested and held support from the low in early 2017 at 1.0340. the eur has since staged a relief rally moving back into the middle of our forecast range. the turnaround for the eur has been reinforced by hawkish comments from president lagarde signalling clearly that the ecb plans to speed up the pace of policy tightening in response to upside inflation risks.”“the removal of negative rate policy should provide more support for the eur going forward given that it has proved effective at helping to keep the eur weak by encouraging record capital outflows into foreign bond markets while it has been in place. it was more normal for eur/usd to trade above the 1.2000-level in the decade prior to the introduction of negative rates.”“the eur’s ability to extend its recent advance much further on the back of the normalization of ecb policy remains constrained by ongoing downside risks from the ukraine conflict. it appears increasingly likely now that the conflict will prove more prolonged than initially hoped and thereby increases the risk of a longer period of disruption for the euro-zone economy that will both dampen growth and keep inflation higher for longer.”,"['eur/usd', 'neutral', 'bias', 'move', '1.03/1.11', 'range', '–', 'mufg']",na,eur/usd,fivemin_counter
177,fxstreet,7,2022-05-24,USD/CAD jumps to six-day highs above 1.2850,the usd/cad broke to the upside after moving in a small range for hours and jumped to 1.2872 reaching the highest level since last thursday. the pair remains near the highs with the bullish momentum intact.weaker loonie usd/cad rebounds from weekly lowsthe loonie dropped across the board during the american session amid risk aversion. it also lost ground versus aud and nzd. the dow jones is falling 1.40 and the nasdaq 3.40. us and canadian yields are falling currently at multi-day lows.the slide in equity prices offered some support to the dollar that was affected by weaker than expected us economic data. the s&p global pmi came in below expectations. the s&p global composite dropped in may to the lowest in five months according to preliminary data at 53.8 down from 56 and below the 55.5 of market consensus. new home sales fell 16.6 in april worse than expectations. on wednesday the fomc minutes will be released. in canada the next important economic report is due on thursday with retail sales.the usd/cad is turning to the upside bouncing from the lowest in two weeks. the pair found support above 1.2760 and now is looking to test the 1.2890 area. a consolidation above 1.2900 should strengthen the outlook for the dollar.on the flip side 1.2815/20 is the key support. if usd/cad falls below the recent low at 1.2764 would be exposed. below the next support stands at 1.2714 may 5 low.  ,"['usd/cad', 'jump', 'six-day', 'highs', '1.2850']",na,usd/cad,fivemin_counter
178,fxstreet,7,2022-05-24,EUR/USD marches firmly above 1.0700 post-ECB members’ hawkish commentary,eur/usd bulls are reclaiming the 1.0700 mark on tuesday courtesy of ecb policymakers expressing the need for the central bank to exit from negative rates by the third quarter of 2022 further emphasized on monday by ecb president christine lagarde. at 1.0732 the eur/usd gains for the second straight day.the greenback remains soft for the second day of the week and is trading below 102.000 the lowest level since april 26 on growing concerns that the federal reserve would not achieve a soft landing and trigger a recession. meanwhile may’s us s&p global pmis showed mixed results with the services and composite index missing expectations while the manufacturing pmi came unchanged.later richmond’s fed manufacturing index plunged to -14 vs. 15 foreseen adding to the list of fed regional manufacturing reports showing deceleration or contraction. late at around 1620 the fed chair jerome powell would cross the wires.in the meantime the us 10-year benchmark note follows the buck’s footsteps and is also down 13 bps sitting at 2.726.during the eurozone session the eu docket witnessed the release of s&p global pmis which showed mixed results. the eu manufacturing and services pmi missed expectations though downtick minimally. the german manufacturing pmi beat expectations carrying on the support from monday’s german ifo readings which showed the resilience of businesses and consumers.further ecb speaking crossed the wires on tuesday. ecb’s president lagarde said “i don’t think that we’re in a situation of surging demand at the moment. it’s definitely an inflation that is fueled by the supply side of the economy. in that situation we have to move in the right direction obviously but we don’t have to rush and we don’t have to panic.” in the meantime ecb’s francois villeroy added that “a 50 bp hike is not part of the consensus at this point i am clear. interest rate hikes will be gradual.”albeit lagarde and villeroy’s efforts to push back additional ecb “hawks” crossed wires. ecb’s holzmann said a 50 bps hike in july would be appropriate. furthermore ecb’s kazakhs added to that list and commented that the central bank should not rule out 50 bps rate rises and look for hikes in july and september and possibly another in q4.in the week ahead the eu docket is packed and will feature german gfk consumer confidence german gdp and france’s consumer confidence. on the us front durable goods orders may’s fomc minutes us gdp growth estimates and the fed’s favorite gauge of inflation the personal consumption expenditure pce.the eur/usd remains downward biased despite the last couple of weeks’ price action which formed a bottom after dropping from 2021 tops at around 1.2349. nevertheless the shared currency is still hovering around the april 2020 lows near 1.0727 which means that a daily close above the previously mentioned would open the door for further gains. otherwise the eur/usd rally to the 1.0720s area would be seen as an opportunity for eur/usd bears to add to their positions and aim for a re-test of the ytd lows at 1.0348.upwards the eur/usd’s first resistance would be the 50-day moving average dma at 1.0767. break above would expose the march 7 daily low at 1.0805 followed by the 1.0900 mark. on the flip side the major’s first support would be 1.0700. a breach of the latter would expose april 2017 daily low at 1.0635 followed by the 20-dma at 1.0535.  ,"['eur/usd', 'march', 'firmly', '1.0700', 'post-ecb', 'members', '’', 'hawkish', 'commentary']",na,eur/usd,fivemin_counter
179,fxstreet,7,2022-05-24,GBP/JPY slumps from above 160 to low 158s dragged lower as UK/US yields tumble post poor-UK/US PMI data,uk government bond yields had already been on the back foot in the lead up to the start of the us trading session in wake of much weaker than expected uk pmi data for may released earlier in the day which triggered renewed fears about the uk’s increasingly fragile inflation plagued economy but that move lower accelerated in tandem with a drop in global yields after disappointing us service pmi numbers which triggered fears about a slowdown in the world’s most important/largest economy.uk 10-year yields were last trading lower by more than 10 bps on the day with similar drops seen in the us and to a lesser extent owing to hawkish ecb commentary the eurozone. as a result uk and global/japan yields differentials have narrowed significantly on the day weighing heavily on g10/jpy pairs owing to the yen’s sensitivity to rate differentials.gbp/jpy was last trading close to one-week lows under the 158.50 mark down about 1.6 or over 250 pips on the day and eyeing a break lower towards monthly lows in the 156.00 area. technicians will note how the 21-day moving average at 160.40 has once again proven a solid level of resistance as has been the case since late april. as global growth fears largely subsume fears about central bank tightening thus sending yields lower g10/jpy pairs like gbp/jpy remain at risk of further losses. traders will likely be targetting a test of the 200dma in the mid-155.00s in the coming weeks.  ,"['gbp/jpy', 'slump', '160', 'low', '158s', 'drag', 'lower', 'uk/us', 'yield', 'tumble', 'post', 'poor-uk/us', 'pmi', 'data']",bear,gbp/jpy,fivemin_counter
180,fxstreet,7,2022-05-24,ECB's Kazaks Shouldn't rule out a 50 bps rate hike sees hikes in July September possible one more in Q4,european central bank policymaker martins kazaks said on tuesday that the bank should not rule out a 50 bps rate hike and that he sees possible rate hikes in july september and potentially one more in q4 reported reuters. his remarks come after fellow ecb policymaker robert holzmann called for a 50 bps move in july ecb's francois villeroy de galhau said a 50 bps rate hike isn't yet consensus at the bank and ecb president christine lagarde reiterated that the bank will take rates out of negative territory in q3. ,"['ecb', ""'s"", 'kazaks', ""n't"", 'rule', '50', 'bps', 'rate', 'hike', 'see', 'hike', 'july', 'september', 'possible', 'one', 'q4']",na,[],fivemin_counter
