,source,page,date,title,body,tokenized,action,pair,duration
141,fxstreet,5,2022-05-25,USD/CNY fix 6.6550 est 6.6543 prev 6.6566,in recent trade today the people’s bank of china pboc set the yuan cny at 6.6550 vs. the estimate of 6.6543 and the previous 6.6566.china maintains strict control of the yuan’s rate on the mainland.the onshore yuan cny differs from the offshore one cnh in trading restrictions this last one is not as tightly controlled.each morning the people’s bank of china pboc sets a so-called daily midpoint fix based on the yuan’s previous day's closing level and quotations taken from the inter-bank dealer.,"['usd/cny', 'fix', '6.6550', 'est', '6.6543', 'prev', '6.6566']",na,[],fivemin_counter
142,fxstreet,5,2022-05-25,USD/JPY leans bearish on a likely slowdown in US growth momentum – Goldman Sachs,analysts at goldman sachs recommended going short on usd/jpy via options over a six-month timeframe in their latest client note.we see a variety of paths to a yen recovery-us economic weakness and/or upward pressure on rates in japan and limited scope for further sustained depreciation.”“we recommend buying a 6m 115 usd/jpy digital put at a price of about 9 to position for a further step-down in us growth momentum over the coming months.”we see meaningful downside risks to our 12m usd/jpy forecast of 123 but maintain this projection for now in light of our colleagues relatively upbeat modal forecasts for us equities us rates and global commodity prices.”,"['usd/jpy', 'lean', 'bearish', 'likely', 'slowdown', 'us', 'growth', 'momentum', '–', 'goldman', 'sachs']",bull,usd/jpy,fivemin_counter
143,fxstreet,5,2022-05-25,GBP/USD Price Analysis Sellers attack short-term key support above 1.2500,gbp/usd takes offers to refresh intraday low around 1.2520 extending the u-turn from the 200-ema towards breaking a one-week-old support line during wednesday’s asian session.given the cable pair’s inability to cross the 200-ema coupled with the bearish macd signals the quote is likely to break the immediate support near 1.2520.the same can direct gbp/usd prices towards one-month-old horizontal support around 1.2420-15.however any further downside past 1.2415 will not hesitate to challenge 1.2260 and the monthly low surrounding 1.2155.alternatively the 200-ema level of 1.2606 restricts the gbp/usd pair’s immediate upside ahead of the monthly peak of 1.2638.should the pair buyers manage to cross the 1.2638 hurdle a convergence of a downward sloping trend line from mid-april and 61.8 fibonacci retracement fibo. of april-may declines around 1.2770 will be in the spotlight.trend further weakness expected  ,"['gbp/usd', 'price', 'analysis', 'sellers', 'attack', 'short-term', 'key', 'support', '1.2500']",na,gbp/usd,fivemin_counter
144,fxstreet,5,2022-05-25,Gold Price Forecast XAU/USD consolidates above $1860 FOMC minutes and US durable Goods eyed,gold price xau/usd is juggling in a nominal range of $1860.42-1869.75 in the asian session as investors are awaiting the release of the federal open market committee fomc minutes in the new-york session. the precious metal has displayed a firmer rally from its recent low of $1786.78 recorded on may 16. a five-day winning streak by the gold prices is advocating the continuation of a bullish momentum which could continue if the asset oversteps tuesday’s high at $1869.75.a significant rise in gold prices is backed by vulnerable performance displayed by the us dollar index dxy. the dxy has tumbled sharply below 102.00 after printing a 19-year high of 105.00 on may 13. considering the positive market mood and dxy’s price action further weakness in the asset cannot be ruled out. in spite of that investors' focus will remain on the release of the fomc minutes.facts that hold significant importance in the fomc minutes are the number of voters behind the advocacy of the 50 basis points bps interest rate hike and economic indicators that may describe the us economic condition in a much more explanatory manner. apart from the fomc minutes the us durable goods data hold significant importance. the us census bureau is expected to report the monthly durable goods orders at 0.6 against the prior print of 1.1.on an hourly scale xau/usd is auctioning in a rising channel that advocates gold bulls. the upper boundary of the rising channel is placed from may 17 high at $1835.97 while the lower boundary is plotted from may 16 low at $1786.78. a golden cross represented by the 50and 200-period exponential moving averages emas has set a bullish bias for the gold prices. the relative strength index rsi 14 has shifted into a bullish range of 60.00-80.00 which adds to the upside filters.    ,"['gold', 'price', 'forecast', 'xau/usd', 'consolidate', '$', '1860', 'fomc', 'minutes', 'us', 'durable', 'goods', 'eye']",na,['usd'],fivemin_counter
145,fxstreet,5,2022-05-25,When is the RBNZ and how it could affect NZD/USD?,early wednesday at 0100 gmt market sees the key monetary policy decision by the reserve bank of new zealand rbnz amid hopes of another hawkish play by the new zealand central bank.despite the recently mixed data at home not to forget china’s growth concerns the rbnz policymakers are likely bracing for a fourth rate hike worth 50 basis points bps to 2.0.although such a rate-hike is already priced-in recent geopolitical tensions surrounding north korea and russia join some optimists calling for consecutive 50 basis points bps of a rate-lifts in the future to make today’s rbnz interest rate decision interesting for the nzd/usd traders.also in the publishing line are the economic projections and governor adrian orr’s speech to watch.ahead of the event australia and new zealand banking group anz saida 50bp hike to 2 is widely expected as the rbnz seeks to get the ocr back to a more neutral level as soon as they can their estimate at the february mps was that neutral is around about 2. interest rate decisions will likely become more difficult over the second half of the year especially as evidence of cooling demand starts to mount. as such we anticipate they will return to more normal 25bp hikes as they assess how previous interest rate hikes are transmitting through the economy.on the same line analysts at westpac saidwestpac expects the rbnz to hike the official cash rate by another 50 basis points to 2.0 with a clear signal of further tightening to come. its ocr forecast will be of particular interest.considering the market consensus fxstreet’s dhwani mehta saidthe currency pair could witness a ‘sell the fact’ trading on an expected 50 bps hike with dovish forward guidance as the rbnz could be worried about hard-landing risks. in such a case an extended correction towards may 20 lows of 0.6363 could be in the offing.the market’s perception at the time of the policy announcement and the us dollar price action ahead of wednesday’s fomc minutes could also affect nzd/usd’s reaction. nzd/usd snaps a four-day uptrend by dropping back to mid-0.6400s ahead of the rbnz. the kiwi pair’s latest weakness could be linked to the us dollar’s rebound from the monthly low as well as to the second-tier threats to the risk appetite.that said the rbnz rate hike worth 50 bps is already priced-in as the nzd/usd prices keep the previous week’s recovery from a two-year low. hence an increase in the benchmark rate worth the estimations won’t make any major difference to the kiwi pair trader until the accompanying economic forecasts portray a rosy picture of the pacific economy which is less anticipated due to the recently mixed statistics.hence nzd/usd prices may provide a knee-jerk reaction to the rbnz’s 50 bps rate hike but any disappointment either via softer rate action or from the rate statement will have larger repercussions.technically nzd/usd justifies tuesday’s pin bar with the recent losses suggesting further pullback towards the 21-dma support of 0.6394. however any further downside will make the kiwi pair vulnerable to testing the 0.6300 threshold. meanwhile the monthly high surrounding 0.6570 stays on the bull’s radar ahead of the rbnz announcements.nzd/usd price analysis bulls seeking a higher correction on weekly chartnew zealand 10-year treasury yields renew five-week low under 3.45 ahead of rbnz nzd/usd can't catch a break ahead of the rbnzreserve bank of new zealand preview will they step up their tightening game?the rbnz interest rate decision is announced by the reserve bank of new zealand. if the rbnz is hawkish about the inflationary outlook of the economy and raises the interest rates it is positive or bullish for the nzd. the rbnz rate statement contains the explanations of their decision on interest rates and commentary about the economic conditions that influenced their decision.,"['rbnz', 'could', 'affect', 'nzd/usd', '?']",na,nzd/usd,fivemin_counter
146,fxstreet,5,2022-05-25,China COVID lockdowns keep markets on edge,beijing has continued its quarantine to end its month-old covid outbreak while in shanghai authorities plan to keep most restrictions in place this month before a more complete lifting of the two-month-old lockdown from june 1.beijing has continued to report covid-19 cases in its now monthlong outbreak as the nearby port city of tianjin locked down a district at the center of the city amid a simmering flareup as bloomberg reports. ''the capital reported 47 new covid cases for tuesday compared with 48 on monday. cases spiked to 99 on sunday the highest of the current outbreak.''meanwhile shanghai reported 343 new local asymptomatic coronavirus cases vs. previous 422 44 symptomatic cases for may 24 vs. 58 prior. the city reported one case outside of quarantined area.global supply chain disruptions are a concern which have been exacerbated by not only the restrictive measures in china to control its latest covid-19 outbreak sending inflation to multi-decade highs but russia's war with ukraine as well.  ,"['china', 'covid', 'lockdowns', 'keep', 'market', 'edge']",na,[],fivemin_counter
147,fxstreet,5,2022-05-25,EUR/USD Price Analysis Pullback from monthly top remains elusive above 1.0710,eur/usd refreshes intraday low around 1.0720 consolidating weekly gains near the monthly peak. in doing so the major currency pair prints weakness below the 50-dma hurdle as well as suggests further downside towards the 11-week-old resistance-turned-support line.it’s worth noting however that a firmer rsi 14 and a clear upside break of the previous resistance line around 1.0710 keep the pair buyers hopeful.even if the quote drops below 1.0710 the early month’s peak of 1.0641 and an upward sloping support line from may 13 close to 1.0570 will precede the 21-dma level of 1.0547 to challenge the eur/usd bears.alternatively the 50-dma level of 1.0765 challenges the short-term upside of the eur/usd pair ahead of a downward sloping trend line from february near 1.0840.should the quote rise past 1.0840 the late april swing high of 1.0936 and the 1.1000 psychological magnet will lure the eur/usd bulls.trend bullish  ,"['eur/usd', 'price', 'analysis', 'pullback', 'monthly', 'top', 'remain', 'elusive', '1.0710']",na,eur/usd,fivemin_counter
148,fxstreet,5,2022-05-25,RBA Ellis rehashes the board minutes and says there will be more rate rises from here,rba assistant governor for economics luci ellis on wednesday has addressed the urban development institute of australia 2022 national conference in sydney on housing in the endemic phase.the comments have been listed by central bank observers for any clues to the likely speed of interest rate hikes in coming months. besides insights to the housing sector on monetary policy ellis argued that there will be more rate rises from here but cannot say where the peak will be from here. despite the prospects of further rate increases the aussie has remained in the early asians session sell-off as the us dollar picks up a bid retracing back to test the vicinity of the early new york session highs as per the dxy index. meanwhile the rba raised the cash rate to 0.35 per cent from a record low 0.1 per cent this month the first increase in over a decade in the face of a spike in inflation to 5.1 per cent.the comments today from ellis are a rehash of the minutes of that board meeting that agreed that further increases in interest rates would likely be required to ensure inflation returns to the two to three per cent target over time.at this stage the market has priced in a further interest rate rise of between 25 basis points and 50 basis points at its june 7 board meeting and a rate of over 1.5 per cent by early next year. ,"['rba', 'ellis', 'rehash', 'board', 'minutes', 'say', 'rate', 'rise']",bull,[],fivemin_counter
149,fxstreet,5,2022-05-25,AUD/USD slips beneath 0.7100 despite RBA’s Ellis signals more rate hikes focus on Fed Minutes,aud/usd retreats to 0.7100 as rba’s ellis raises housing market concerns during wednesday’s asian session. in doing so the aussie pair also takes clues from the recent geopolitical tensions surrounding north korea and the us as well as the cautious mood ahead of the latest federal open market committee fomc minutes.rba assistant governor economic luci ellis said there will be more rate rises from here. the policymaker also mentioned that the housing industry is at capacity as supply lines snarl per reuters. the policymaker also said “australia's housing industry has a strong pipeline of new work but faces global supply disruptions and rising material costs which are delaying completions and squeezing margins”. elsewhere north korea’s firing of three missiles and japan’s dislike for the same join the market’s anxiety ahead of the today’s fed minutes seem to also weigh on the market’s optimism and probe the aud/usd pair.it’s worth noting that a pause in the us treasury yields’ fall around the monthly low near 2.70 also seems to probe the aud/usd buyers.on tuesday downbeat prints of the us housing data and repeated fedspeak in contrast to the hawkish comments from the ecb exerted downside pressure on the us dollar. however the australian dollar also couldn’t cheer the greenback’s weakness as may’s pmis from the pacific major also came in downbeat.amid these plays the s&p 500 futures rise half a percent after mixed closing on the wall street whereas the us 10-year treasury yields dropped the most in a week to refresh a one-month low of around 2.717.moving australia’s q1 2022 construction work done expected 1.0 versus the prior 0.4 may entertain aud/usd traders but major attention will be given to the us durable goods orders for april and fomc minutes.read fomc may minutes preview will the fed have to sell mbs?unless staying beyond the 0.7035-40 support confluence including the 21-dma and previous resistance line from april 05 aud/usd prices remain directed towards the monthly high of 0.7267.  ,"['aud/usd', 'slip', 'beneath', '0.7100', 'despite', 'rba', '’', 'ellis', 'signal', 'rate', 'hike', 'focus', 'feed', 'minutes']",bear,aud/usd,fivemin_counter
150,fxstreet,5,2022-05-25,US Dollar Index auctions below 102.00 ahead of FOMC minutes risk-on impulse active,the us dollar index dxy is looking to extend its losses after violating tuesday’s low at 101.65 as the soaring market mood has diminished the appeal of the safe-haven assets. the dxy is scaling sharply lower from the past eight trading sessions after failing to hold the 19-year high at 105.00. the weakness in the dxy is backed by the expectations of recession in the us amid an aggressive rate hike cycle.the market participants are expecting that the federal reserve fed has pulled the trigger of recession in the us while containing the inflation mess. the program of liquidity absorption from the market may force the corporate to stick to ultra-filtered investment avenues as the unavailability of dirt-cheap money will result in a restricted investment portfolio.fomc minutesthe show-stopper event on wednesday will be the release of the federal open market committee fomc minutes. it will be worth watching the strategic decision-making of fed policymakers behind the adaptation of the hawkish tone by fed chair jerome powell. also the fomc minutes will provide a clear picture of the economic condition of the us.key events this week durable goods orders initial jobless claims gross domestic product gdp core personal consumption expenditure pce and michigan consumer sentiment index csi.major events this week  fomc minutes european central bank ecb’s christine lagarde speech reserve bank of new zealand rbnz interest rate decision.  ,"['us', 'dollar', 'index', 'auction', '102.00', 'ahead', 'fomc', 'minutes', 'risk-on', 'impulse', 'active']",na,['usd'],fivemin_counter
151,fxstreet,5,2022-05-25,NZD/USD Price Analysis Bulls seeking a higher correction on weekly chart,as per the prior analysis nzd/usd price analysis bears break the neckline of h1 head and shoulders 0.6420 eyed the bears broke out of the h&s and moved in on the 0.6420s. the price has since reverted back to the upside to test daily resistance again ahead of the reserve bank of new zealand. the following analysis illustrates the recent price trajectory and how the schematics have played out across a number of time frames for a clear picture of the market's structures heading into the meeting. there is something for both the bulls and bears across the multi-time frame analysis.   from a weekly perspective there is room for a higher correction into the prior weekly swing lows that have a confluence with the 38.2 fibonacci retracement level near 0.6530.heading into the rbnz however the daily chart is worth taking into accountthere are prospects of a deeper correction to test the prior resistance at a 38.2 fibo of 0.6416. the move would also be filling in the wick of the prior day's trade which is a typical occurrence in clearing up some unfinished business on the 4-hour chart by the bears. the m-formation's neckline has offered resistance and the bears are taking over with the old resistance eyed to the aforementioned 0.6416  area. ,"['nzd/usd', 'price', 'analysis', 'bull', 'seek', 'higher', 'correction', 'weekly', 'chart']",bull,nzd/usd,fivemin_counter
152,fxstreet,5,2022-05-24,GBP/USD eyes to recapture 1.2600 on positive market mood FOMC eyed,the gbp/usd pair has rebounded gradually from a low of 1.2475 as positive market sentiment has underpinned the risk-sensitive currencies. the cable witnessed a steep fall on tuesday after failing to overstep the round level resistance of 1.2600. the asset was offered on tuesday amid poor s&p global purchase managers index pmi numbers. a severe underperformance was displayed on the economic data front by the uk as the services pmi landed at 51.8 vs. 57.3 as expected while the manufacturing pmi was recorded lower at 54.6 vs. 55.1 forecasts.meanwhile the us dollar index dxy is oscillating in a minor range of 101.74-101.79 in early tokyo after a two-day losing streak. the asset has displayed a bearish reversal after establishing below the crucial support of 102.35. failing to sustain at 19-year high levels of 105.00 the asset has surrendered more than 3 gains in the past eight trading sessions. the ihs markit reported an at par performance by the us on the pmi data front. the manufacturing pmi landed at 57.5 in line with the forecasts while the services pmi remained lower at 53.5.now investors are focusing on the release of the federal open market committee fomc minutes which will dictate the strategic development behind the announcement of the 50 basis points bps interest rate decision by the federal reserve fed.  ,"['gbp/usd', 'eye', 'recapture', '1.2600', 'positive', 'market', 'mood', 'fomc', 'eye']",na,gbp/usd,fivemin_counter
153,fxstreet,5,2022-05-24,Silver Price Analysis XAG/USD bulls eye monthly hurdle above $22.00 on crossing 21-DMA,silver xag/usd pierces the 21-dma while extending the previous day’s run-up to a fortnight high during wednesday’s asian session. that said the bright metal rises to $22.15 at the latest.not only a break of the short-term key moving average but bullish macd signals also underpin the upside bias for the commodity prices.that said a descending trend line from april 29 around $22.40 appears immediate key resistance for the quote to cross.following that a run-up towards the $23.00 threshold and late april swing high close to $23.60 can’t be ruled out.however an area comprising the 50-dma and the 100-dma around $23.70-80 appears a tough nut to crack for the xag/usd bulls afterward.on the contrary pullback moves may have to defy the dma breakout around $22.00 by the press time to direct silver prices towards a two-week-long horizontal rea near $21.20-10.in a case where the metal remains weak past $21.10 also conquers the $21.00 threshold it can plummet to the $20.00 psychological magnet.trend further upside expected  ,"['silver', 'price', 'analysis', 'xag/usd', 'bull', 'eye', 'monthly', 'hurdle', '$', '22.00', 'cross', '21-dma']",bear,[],fivemin_counter
154,fxstreet,6,2022-05-24,New Zealand 10-year Treasury yields renew five-week low under 3.45 ahead of RBNZ,new zealand nz markets remain cautious ahead of the key reserve bank of new zealand rbnz interest rate decision up for publishing at 0200 am gmt on wednesday.while portraying the mood the benchmark 10-year treasury yields drop to the lowest level since april 18 down 0.30 around 3.443 at the latest. on the same line is new zealand’s key equity index nzx 50 which extends the previous day’s losses down 0.11 intraday by the press time.the reason for the latest pessimism in the market despite the widely anticipated rate hike of 50 basis points bps to the official cash rate ocr of 1.5 could be linked to the recently downbeat nz q1 2022 retail sales.it’s worth noting that the mostly priced-in rate hike gives rise to a view that any disappointment either via softer rate action or from the rate statement will have larger repercussions.read reserve bank of new zealand preview will they step up their tightening game?,"['new', 'zealand', '10-year', 'treasury', 'yield', 'renew', 'five-week', 'low', '3.45', 'ahead', 'rbnz']",bear,['nzd'],fivemin_counter
155,fxstreet,6,2022-05-24,USD/CAD Price Analysis Keeps bounce off 1.2770 key support,usd/cad defends the bounce off the 1.2770 key support taking rounds to 1.2815-20 during wednesday’s asian session. in doing so the loonie pair seesaws between the 100-sma and 200-sma amid steady rsi conditions.hence the quote is likely to remain sidelined until either breaking the 100-sma level of 1.2880 or the 1.2770 support confluence including the 200-sma together with the one-month-old ascending trend line and 50 fibonacci retracement of april 21 to may 12 upside.even if the usd/cad prices manage to cross the 110-pip trading range a three-week-old horizontal area and 61.8 fibo. will challenge the momentum around 1.2920 and 1.2685 in that order.it’s worth noting that the quote’s moves past the aforementioned range are likely to create havoc.that said the nearly two-week-long consolidation of gains and the recent us dollar weakness suggest short-term favor to the bears. however a clear downside break of the 1.2685 support seems less likely.on the contrary an upside break of the 1.2920 hurdle won’t hesitate to renew the monthly peak around 1.3080 by the press time.trend sideways  ,"['usd/cad', 'price', 'analysis', 'keep', 'bounce', '1.2770', 'key', 'support']",na,usd/cad,fivemin_counter
156,fxstreet,6,2022-05-24,USD/JPY Price Analysis H&S breakdown cheers yen bulls 125.00 eyed,the usd/jpy pair is attempting a pullback towards the round-level resistance of 127.00 after a vertical downside move to a low of 126.48 on tuesday. the pair witnessed a steep fall on tuesday after slipping below a two-day low of 127.09. an imbalance move from the previous auction area of 127.09-128.32 has dampened the demand for the greenback.a breakdown of the head and shoulder chart pattern on an hourly scale is underpinning the japanese yen against the greenback. the breakdown of an h&s pattern denotes a prolonged inventory distribution from institutional investors to retain participants. a decisive slippage below the round level support of 127.00 has marked the trigger of the h&s breakdown.the death cross represented by the 50and 200-period exponential moving averages emas at 130.00 is signaling a confirmed bearish bias in the counter.meanwhile a range shift has been displayed by the relative strength index rsi 14 from 40.00-60.00 to the bearish range of 20.00-40.00 which advocates more downside.investors should attempt shorts after a pullback towards the 50-ema at 127.38 for a downside move to tuesday’s low at 126.48 followed by the round-level support at 125.00.alternatively the greenback bulls could regain strength if the asset oversteps thursday’s high at 128.95 which will drive the asset towards may 17 high at 129.78. a breach of the latter will expose the asset to recapture its multi-year high at 131.28.    ,"['usd/jpy', 'price', 'analysis', 'h', '&', 'breakdown', 'cheer', 'yen', 'bull', '125.00', 'eye']",na,usd/jpy,fivemin_counter
