,source,page,date,title,body,tokenized,action,pair,duration
0,investing,1,2022-05-25,Dollar rises off of 1-month low ahead of Fed minutes, by john mccrank new york reuters the u.s. dollar snapped a two-day losing streak on wednesday ahead of the release of the minutes from the u.s. federal reserve's may meeting...,"['dollar', 'rise', '1-month', 'low', 'ahead', 'feed', 'minutes']",na,[],fivemin_counter
1,investing,1,2022-05-25,Analysis-As U.S. economy's exceptionalism fades so does the dollar, by tommy wilkes and saikat chatterjee london reuters the dollar's rally to two-decade highs appears to have stalled with doubts growing on whether the u.s. economy will prove...,"['analysis-as', 'u.s.', 'economy', ""'s"", 'exceptionalism', 'fade', 'dollar']",na,['usd'],fivemin_counter
2,investing,1,2022-05-25,Russia will start a pilot project for 'digital' rouble from April cbank,"
reuters russia will start a pilot project using its digital rouble with real customers and real transactions from april 2023 its central bank said on wednesday adding...","['russia', 'start', 'pilot', 'project', ""'digital"", ""'"", 'rouble', 'april', 'cbank']",na,[],fivemin_counter
3,investing,1,2022-05-25,Rouble firms to 4-yr high vs dollar as Russian debt payment licence expires, reuters the russian rouble firmed past 56 against the dollar on wednesday for the first time since 2018 and touched a seven-year high against the euro as export-focused...,"['rouble', 'firm', '4-yr', 'high', 'vs', 'dollar', 'russian', 'debt', 'payment', 'licence', 'expire']",bull,[],fivemin_counter
4,investing,1,2022-05-25,Dollar Stabilizes but Hikes Elsewhere Point to Further Weakness,"by geoffrey smith
investing.com -the dollar stabilized in early trade on wednesday after falling on tuesday as a collapse in new home sales and a slump in social media stocks...","['dollar', 'stabilize', 'hike', 'elsewhere', 'point', 'weakness']",na,[],fivemin_counter
5,investing,1,2022-05-25,Dollar Up Ahead of the Fed Minutes Release,"by gina lee
investing.com – the dollar was up on wednesday morning in asia as investors awaited minutes from the last u.s. federal reserve meeting.
the u.s. dollar index that...","['dollar', 'ahead', 'feed', 'minutes', 'release']",na,[],fivemin_counter
6,investing,1,2022-05-25,Dollar Bulls on Ice as Bets for Fed Pause on Rate Hikes Gather Pace,"by yasin ebrahim 
investing.com -the melt-up in dollar has come unstuck recently as the odds of the federal reserve putting its rate hike mission on ice later this year gather...","['dollar', 'bull', 'ice', 'bet', 'feed', 'pause', 'rate', 'hike', 'gather', 'pace']",na,[],fivemin_counter
7,investing,1,2022-05-25,Dollar at one-month low as Lagarde comments lift euro, by john mccrank new york reuters the u.s. dollar index hit nearly a one-month low on tuesday after european central bank president christine lagarde said euro zone interest...,"['dollar', 'one-month', 'low', 'lagarde', 'comment', 'lift', 'euro']",bear,['eur'],fivemin_counter
8,investing,1,2022-05-24,Russian rouble firms past 57 to the dollar for first time in four years, reuters -the russian rouble strengthened to levels not seen since march 2018 against the dollar on tuesday boosted by export-focused companies selling foreign currency to pay...,"['russian', 'rouble', 'firm', 'past', '57', 'dollar', 'first', 'time', 'four', 'years']",na,[],fivemin_counter
9,investing,1,2022-05-24,Pound Tumbles as Rate-Hike Bets Cut on Renewed Recession Fears,bloomberg -the pound tumbled and investors rushed to the safety of government bonds after an index of uk private sector growth unexpectedly slid in may to reawaken fears of a...,"['pound', 'tumble', 'rate-hike', 'bet', 'cut', 'renew', 'recession', 'fear']",bear,['gbp'],fivemin_counter
10,investing,1,2022-05-24,Dollar Weakens After Lagarde Props Up Euro Risk-Off Tone Still Dominant,"by geoffrey smith
investing.com -the dollar fell again in morning trade in europe after european central bank president christine lagarde chose not to rule out a 50 basis point...","['dollar', 'weaken', 'lagarde', 'prop', 'euro', 'risk-off', 'tone', 'still', 'dominant']",na,['eur'],fivemin_counter
11,investing,1,2022-05-24,Dollar Up but Small Signs of Economic Recovery Limits Gains,"by gina lee
investing.com – the dollar was up on tuesday morning in asia. the safe-haven asset clawed back some of its overnight losses and the yen also strengthened as u.s....","['dollar', 'small', 'sign', 'economic', 'recovery', 'limit', 'gain']",bull,[],fivemin_counter
12,investing,1,2022-05-23,Euro climbs as ECB eyes rate hikes dollar slides, by sinéad carew new york reuters the dollar index fell on monday while the euro rallied after the european central bank indicated a move from negative interest rates and...,"['euro', 'climb', 'ecb', 'eye', 'rate', 'hike', 'dollar', 'slide']",na,['eur'],fivemin_counter
13,investing,1,2022-05-23,Russia cuts mandatory FX conversion level for exporters to 50, reuters russia is cutting the proportion of foreign currency revenues that exporters must convert into roubles to 50 from 80 the finance ministry said on monday after the...,"['russia', 'cut', 'mandatory', 'fx', 'conversion', 'level', 'exporters', '50']",na,[],fivemin_counter
14,investing,1,2022-05-23,Ruble Hits 4-Year High as Energy Exports Fill Current Account,"by geoffrey smith 
investing.com -the russian ruble surged again to a new four-year high on monday as the weight of foreign inflows generated by its energy exports continued to...","['ruble', 'hit', '4-year', 'high', 'energy', 'export', 'fill', 'current', 'account']",bull,[],fivemin_counter
15,investing,1,2022-05-23,Russian rouble leaps to near 7-year high vs euro, reuters -the russian rouble firmed more than 6 against the euro on monday to a near seven-year high boosted by capital controls strong oil prices and an upcoming month-end...,"['russian', 'rouble', 'leap', 'near', '7-year', 'high', 'vs', 'euro']",bull,['eur'],fivemin_counter
16,investing,1,2022-05-23,Biden Says He’ll Review Trump’s China Tariffs Fueling Yuan Rally,bloomberg -us president joe biden said he’ll review trump-era tariffs imposed on imports from china amid growing calls from businesses to remove the levies fueling a rally in...,"['biden', 'say', '’', 'review', 'trump', '’', 'china', 'tariff', 'fuel', 'yuan', 'rally']",na,[],fivemin_counter
17,investing,1,2022-05-23,Dollar Slips Risk Sentiment on the Rise,"by peter nurse
investing.com the u.s. dollar weakened in early european trade monday with risk sentiment boosted by hopes that loosening lockdowns in china can help global...","['dollar', 'slip', 'risk', 'sentiment', 'rise']",na,[],fivemin_counter
18,investing,1,2022-05-22,Dollar Down Investors Cut Bets on Further Dollar Gains,"by gina lee
investing.com – the dollar was down on monday morning in asia as investors cut bets on further gains from rising u.s. interest rates and hoped that loosening lockdowns...","['dollar', 'investors', 'cut', 'bet', 'dollar', 'gain']",bull,[],fivemin_counter
19,investing,1,2022-05-20,U.S. dollar net long bets slip bitcoin futures surge-CFTC Reuters data, new york reuters speculators' net long positioning on the u.s. dollar slipped after hitting their highest level since late november in the previous week according to...,"['u.s.', 'dollar', 'net', 'long', 'bet', 'slip', 'bitcoin', 'futures', 'surge-cftc', 'reuters', 'data']",bear,['usd'],fivemin_counter
20,investing,1,2022-05-20,Dollar catches a break after bruising week as investors turn risk averse, by saqib iqbal ahmed new york reuters the u.s. dollar rose against the euro on friday as investor unease about the potential economic fallout from federal reserve's efforts...,"['dollar', 'catch', 'break', 'bruise', 'week', 'investors', 'turn', 'risk', 'averse']",na,[],fivemin_counter
21,investing,1,2022-05-20,Sterling set for its biggest weekly rise since Dec 2020 vs dollar, reuters -sterling was set for its biggest weekly gain since december 2020 against a weakening dollar as the latest economic data suggested the market might not need to scale...,"['sterling', 'set', 'biggest', 'weekly', 'rise', 'since', 'dec', '2020', 'vs', 'dollar']",bull,['gbp'],fivemin_counter
22,investing,1,2022-05-20,G7 finance leaders reaffirm FX commitment in communique, by leika kihara and francesco canepa koenigswinter germany reuters group of seven g7 finance leaders on friday pledged to closely monitor markets given recent volatility...,"['g7', 'finance', 'leaders', 'reaffirm', 'fx', 'commitment', 'communique']",na,[],fivemin_counter
23,investing,1,2022-05-20,China offers more forex hedging tools in wake of yuan volatility, shanghai reuters -china's foreign exchange regulator said on friday it would offer new derivatives tools to help companies better hedge their currency risks after recent huge...,"['china', 'offer', 'forex', 'hedge', 'tool', 'wake', 'yuan', 'volatility']",na,[],fivemin_counter
24,investing,1,2022-05-20,Rouble hits 2015 level against euro as EU prepares to pay for gas, reuters -the russian rouble rallied to its strongest levels against the euro and dollar since june 2015 and march 2018 respectively on friday which analysts attributed to eu...,"['rouble', 'hit', '2015', 'level', 'euro', 'eu', 'prepare', 'pay', 'gas']",na,['eur'],fivemin_counter
25,investing,1,2022-05-20,Japan PM says important to keep close ties with overseas FX authorities Nikkei interview, tokyo reuters japanese prime minister fumio kishida said it was important for japan to maintain close ties with overseas currency authorities in an exclusive interview with...,"['japan', 'pm', 'say', 'important', 'keep', 'close', 'tie', 'overseas', 'fx', 'authorities', 'nikkei', 'interview']",na,[],fivemin_counter
26,investing,1,2022-05-20,Dollar Edges Higher but Set for Losing Week China Cuts Key Rate,"by peter nurse
investing.com the u.s. dollar edged higher in early european trade friday but is still heading for its worst week since february as traders reacted to lower u.s....","['dollar', 'edge', 'higher', 'set', 'lose', 'week', 'china', 'cut', 'key', 'rate']",bull,[],fivemin_counter
27,investing,1,2022-05-19,Dollar Up but Set for Worst Week Since Feb 2022 as Headwinds Remain,"by gina lee
investing.com – the dollar was up on friday morning in asia headed for its worst week since early february 2022 as u.s. treasury yields retreat and fatigue after the...","['dollar', 'set', 'worst', 'week', 'since', 'feb', '2022', 'headwinds', 'remain']",bear,[],fivemin_counter
28,investing,1,2022-05-19,Euro Racks up Gains Against Dollar as ECB Liffoff Expectations Gather Pace,"by yasin ebrahim
investing.com -the euro surged against the dollar thursday as the release of the account of the european central bank’s april meeting showed concern over...","['euro', 'rack', 'gain', 'dollar', 'ecb', 'liffoff', 'expectations', 'gather', 'pace']",bull,['eur'],fivemin_counter
29,investing,1,2022-05-19,Dollar drops as yen Swiss franc draw safe-haven flows, by saqib iqbal ahmed new york reuters -the dollar slipped across the board on thursday falling to a 2-week low extending its pullback from a two-decade high as most major...,"['dollar', 'drop', 'yen', 'swiss', 'franc', 'draw', 'safe-haven', 'flow']",bear,chf/jpy,fivemin_counter
30,investing,1,2022-05-19,Russia to ease restrictions on cash FX apart from U.S dollars euros,"
reuters russia's central bank said on thursday banks would be allowed to sell citizens foreign currency without any restrictions from may 20 with the exception of u.s....","['russia', 'ease', 'restrictions', 'cash', 'fx', 'apart', 'u.s', 'dollars', 'euros']",na,['eur'],fivemin_counter
31,investing,1,2022-05-19,Russian rouble firms past 62 vs dollar as tax payments loom, reuters the russian rouble firmed past 62 against the dollar on thursday propped up by capital controls as well as looming tax payments that usually require extra conversion...,"['russian', 'rouble', 'firm', 'past', '62', 'vs', 'dollar', 'tax', 'payments', 'loom']",na,[],fivemin_counter
32,investing,1,2022-05-19,Daily FX trading volumes reach $1.86 trln in April up 5 CLS, london reuters average daily foreign exchange trading volumes in april hit $1.86 trillion 5 higher than a year earlier as volatility shot higher and investors bought and...,"['daily', 'fx', 'trade', 'volumes', 'reach', '$', '1.86', 'trln', 'april', '5', 'cls']",na,[],fivemin_counter
33,investing,1,2022-05-19,Dollar Edges Lower Risk Sentiment Remains Fragile,"by peter nurse
investing.com the u.s. dollar edged lower in early european trade thursday handing back some of the previous session’s substantial gains although the safe haven...","['dollar', 'edge', 'lower', 'risk', 'sentiment', 'remain', 'fragile']",bear,[],fivemin_counter
34,investing,1,2022-05-18,Dollar Down but Investor Sentiment Remains Fragile Over Recession Fears,"by gina lee
investing.com – the dollar was down on thursday morning in asia. safe-haven currencies pressed paused after the previous session’s big gains. however concerns are...","['dollar', 'investor', 'sentiment', 'remain', 'fragile', 'recession', 'fear']",bear,[],fivemin_counter
35,investing,2,2022-05-18,Analysis-British Pound The sick man of the currency world, by saikat chatterjee london reuters in volatile currency markets one trade stands out as an easy bet selling the british pound. with the world's fifth-biggest economy...,"['analysis-british', 'pound', 'sick', 'man', 'currency', 'world']",na,['gbp'],fivemin_counter
36,investing,2,2022-05-18,Dollar recovers ground as risk appetite fades, by saqib iqbal ahmed new york reuters -the u.s. dollar rose on wednesday on pace to snap a three-session losing streak as concerns about the outlook for global economic growth...,"['dollar', 'recover', 'grind', 'risk', 'appetite', 'fade']",na,[],fivemin_counter
37,investing,2,2022-05-18,Pound falls as UK inflation hits 40-year high, by lucy raitano london reuters -britain's pound fell against the dollar on wednesday pulling away from almost two-week highs after data showing british inflation rising to a...,"['pound', 'fall', 'uk', 'inflation', 'hit', '40-year', 'high']",na,['gbp'],fivemin_counter
38,investing,2,2022-05-18,S.African central bank eyes digital rand to cut cross-border payment costs, by rachel savage and promit mukherjee london/johannesburg reuters a digital rand in south africa could cut the high cost of cross-border payments for banks but its...,"['s.african', 'central', 'bank', 'eye', 'digital', 'rand', 'cut', 'cross-border', 'payment', 'cost']",na,[],fivemin_counter
39,investing,2,2022-05-18,Rouble dips against dollar after Russia eases capital controls, reuters the russian rouble weakened against the dollar on wednesday but steadied not far from a five-year high against the euro after losing the support of some capital...,"['rouble', 'dip', 'dollar', 'russia', 'ease', 'capital', 'control']",bear,[],fivemin_counter
40,investing,2,2022-05-18,Dollar Edges Higher U.K. Inflation Soars to 40-Year Highs,"by peter nurse
investing.com the u.s. dollar edged higher in early european trade wednesday rebounding after overnight losses while sterling weakened after u.k. inflation...","['dollar', 'edge', 'higher', 'u.k.', 'inflation', 'soar', '40-year', 'highs']",bull,['gbp'],fivemin_counter
41,investing,2,2022-05-18,Dollar Up Improving Risk Sentiment Boosts Euro and Pound,"by gina lee
investing.com – the dollar was up on wednesday morning in asia. overnight surges gave the euro and pound a boost in early trading alongside strong u.k. jobs data and a...","['dollar', 'improve', 'risk', 'sentiment', 'boost', 'euro', 'pound']",na,eur/gbp,fivemin_counter
42,investing,2,2022-05-17,U.S. considering move to block Russian debt payments -Treasury, by steve holland washington reuters -the united states is considering blocking russia’s ability to pay its u.s. bondholders by allowing a key waiver to expire next week a u.s....,"['u.s.', 'consider', 'move', 'block', 'russian', 'debt', 'payments', '-treasury']",na,['usd'],fivemin_counter
43,investing,2,2022-05-17,GBP Rallies as Strong Jobs Data Keeps BoE Rate Hike in Play Record Inflation Eyed,"by yasin ebrahim
investing.com -the pound surged against the dollar tuesday as a stronger-than-expected labor market is expected to give the bank of england the green light to...","['gbp', 'rally', 'strong', 'job', 'data', 'keep', 'boe', 'rate', 'hike', 'play', 'record', 'inflation', 'eye']",bull,['gbp'],fivemin_counter
44,investing,2,2022-05-17,Dollar slips as risk appetite returns, by saqib iqbal ahmed new york reuters -the dollar fell for a third straight day on tuesday pulling back from a two-decade high against a basket of major peers as an uptick in...,"['dollar', 'slip', 'risk', 'appetite', 'return']",bear,[],fivemin_counter
45,investing,2,2022-05-17,Lira Plunges Ninth Day as Turkish Banks Cut Down Dollar Sales,"bloomberg -sign up for our middle east newsletter and follow us @middleeast for news on the region.
turkey’s lira tumbled for a ninth day hitting a new low for the year as...","['lira', 'plunge', 'ninth', 'day', 'turkish', 'bank', 'cut', 'dollar', 'sales']",bear,[],oneday_counter
46,investing,2,2022-05-17,Indian rupee off record lows on RBI intervention bond yields rise, by swati bhat mumbai reuters the indian rupee gradually recovered after touching a record low on tuesday after the central bank intervened while bond yields edged higher...,"['indian', 'rupee', 'record', 'low', 'rbi', 'intervention', 'bond', 'yield', 'rise']",na,[],fivemin_counter
47,investing,2,2022-05-17,Rouble reverses rally as Russia eases capital controls, reuters the russian rouble weakened on tuesday stepping away from near five-year highs against the euro after the central bank eased some capital controls that were the main...,"['rouble', 'reverse', 'rally', 'russia', 'ease', 'capital', 'control']",na,[],fivemin_counter
48,investing,2,2022-05-17,Dollar Edges Lower as Risk Appetite Returns,"by peter nurse
investing.com the u.s. dollar edged lower in early european trade tuesday slipping back from a 20-year high as gains in global equity markets helped risk appetite...","['dollar', 'edge', 'lower', 'risk', 'appetite', 'return']",bear,[],fivemin_counter
49,investing,2,2022-05-16,Dollar Up but Falls From 20-Year High While Yuan Pauses Tumble,"by gina lee
investing.com – the dollar was up on tuesday morning in asia as it continues its fight for a footing. the chinese yuan found a floor from its recent drop however with...","['dollar', 'fall', '20-year', 'high', 'yuan', 'pause', 'tumble']",bear,[],fivemin_counter
50,investing,2,2022-05-16,Dollar slips from 2-decade highs yuan falls on weak China data, by sinéad carew new york reuters the u.s. dollar index was lower on monday after hitting a 20-year peak last week with the global economy in focus after weak economic data...,"['dollar', 'slip', '2-decade', 'highs', 'yuan', 'fall', 'weak', 'china', 'data']",bear,[],fivemin_counter
51,investing,2,2022-05-16,Russian rouble near 5-year highs versus euro stocks up,reuters -the russian rouble firmed past 64 per dollar on monday briefly jumping to 62.71 to the greenback and climbed towards its highest in nearly five years against the euro...,"['russian', 'rouble', 'near', '5-year', 'highs', 'versus', 'euro', 'stock']",na,['eur'],fivemin_counter
52,fxstreet,0,2022-05-25,Gold Price Forecast XAU/USD slumps towards $1840s as traders book profits ahead of FOMC minutes,gold spot xau/usd slides below the 20-day moving average dma and accelerates towards the 200-dma at $1839.66 on wednesday courtesy of a positive market mood. at the time of writing xau/usd is trading at $1844.98 down 1.10.on wednesday the non-yielding metal alongside other precious metals falls as the greenback remains buoyant and jumps from weekly lows. the us dollar index a gauge of the greenback’s value is gaining 0.52 currently at 102.300. meanwhile the us 10-year treasury yield is almost flat in the day stationary at 2.752 as market players wait for the federal reserve’s open market committee may minutes.sentiment-wise market players shrugged off concerns that the federal reserve’s tightening cycle could cause a recession. global equities are recording solid gains. meanwhile money market futures showed that investors are scaling back their bets on the federal funds rate ffr for 2023 widely expected to finish around 3 to just above the 2.50 threshold.on tuesday the atlanta fed president raphael bostic stated that the fed might pause its tightening cycle once hiking rates to the 2 threshold so the central bank can witness how the economy behaves.before wall street opened the us economic docket unveiled housing data which came mixed but tilted positively albeit concerns that the us economy might hit a recession. at the same time the durable goods orders for april grew steadily but missed expectations. at around 1800 gmt the federal reserve would unveil its may minutes giving traders additional clues regarding the us central bank monetary policy plans.in the week ahead the us docket would feature gdp estimate figures initial jobless claims pending home sales and the fed’s favorite measurement for inflation the personal consumption expenditure pce.on wednesday the xau/usd remains downward pressured tumbling below the 20-dma and also threatening to slide beneath the trend-setter 200-dma at $1839.66. it appears that gold’s pullback could be some profit-taking ahead of the release of the fomc minutes. however any further hawkish reinforcement by the fed’s minutes could send the yellow metal towards the aforementioned 200-dma and beyond targeting may lows around $1786.50.  ,"['gold', 'price', 'forecast', 'xau/usd', 'slump', 'towards', '$', '1840s', 'traders', 'book', 'profit', 'ahead', 'fomc', 'minutes']",bear,[],fivemin_counter
53,fxstreet,0,2022-05-25,GBP/USD bounces from weekly lows and marches firmly above 1.2530s pre-FOMC minutes,the british pound recovers some ground on wednesday during the north american session bouncing near weekly lows around 1.2480s and back above the 1.2500 figure. at 1.2545 the gbp/usd grinds higher due to an improved market mood.invertors’ shrugged off federal reserve concerns that aggressive tightening might cause a recession. on tuesday atlanta’s fed president raphael bostic who leans towards the hawkish end of the spectrum sounded dovish saying that the us central bank might pause its tightening cycle once rates hit the 2 threshold so the central bank can witness how the economy behaves.meanwhile global equities pare some of their weekly losses reflecting the upbeat move while the greenback rises. the us dollar index a measurement of the buck’s value against a basket of six currencies reclaims the 102.000 mark gaining 0.40 putting a lid on the gbp/usd rally. the us 10-year treasury yield remains flat around the 2.752 mark.the us economic docket featured housing data which came in mixed but tilted positively despite concerns about the us's growing economic outlook. later april’s durable goods orders grew at a slower pace than foreseen but kept positive. at around 1800 gmt the federal reserve will unveil its may minutes giving traders additional clues regarding the us central bank monetary policy plans.in the meantime the atlanta fed gdp now the projection of us gdp for the second quarter rose to 1.8 lower than the previous reading which came in at 2.1.an absent uk docket leaves gbp/usd traders adrift to boe-speak led by its chief economist huw pill. earlier pill said that too much tightening runs the risk of getting stuck in a deep recession but too little tightening runs the risk of inflation gaining self-sustaining momentum. pill's remarks came a day after a raft of downbeat uk pmi data which reignited fears about a uk economic slowdown threatening to keep the central bank from further tightening monetary conditions.the gbp/usd is downward biased albeit recovering some ground. nevertheless a solid resistance area looms at the may 4 daily highs near 1.2638 a resistance just shy of a four-month-old downsloping trendline that passes above 1.2700. that ceiling area would be difficult to overcome for gbp/usd bulls but once cleared a re-test of the 1.3000 area is on the cards. otherwise a break below 1.2470 would expose the major to further selling pressure that could send the pair for a re-test of the ytd lows at around 1.2155.  ,"['gbp/usd', 'bounce', 'weekly', 'low', 'march', 'firmly', '1.2530s', 'pre-fomc', 'minutes']",bear,gbp/usd,fivemin_counter
