page,date,title,body,source
2,2022-05-25,ECB's Rehn: We will revise lower economic projections next month,"European Central Bank (ECB) policymaker Olli Rehn said Wednesday, “we will revise lower economic projections next month.”He added that “the upside risks to inflation have increased.”His comments come after the central bank warned its Financial Stability Review that an abrupt increase in real interest rates could induce corrections in the real estate market.EUR/USD is on a corrective decline below 1.0700, currently trading at 1.0677, down 0.55% so far.",fxstreet
2,2022-05-25,ECB: Abrupt increase in rates could induce house price corrections in eurozone,"The European Central Bank (ECB) said in its Financial Stability Review on Wednesday that an abrupt increase in real interest rates could induce corrections in the real estate market, per Reuters.""An abrupt increase in real interest rates could induce house price corrections in the near term, with the current low level of interest rates making substantial house price reversals more likely,"" the ECB explained. ""Further corrections in financial markets could be triggered by escalation of war, even weaker global growth or if monetary policy needs to adjust faster than expected.""EUR/USD extended its downward correction on the ECB's publication and was last seen losing 0.6% on the day at 1.0670.",fxstreet
2,2022-05-25,"GBP/USD sticks to modest gains near mid-1.2500s, upside potential seems limited","The GBP/USD pair built on the previous day's late bounce from the 1.2470 region and gained some follow-through traction on Wednesday. The pair held on to its modest intraday gains through the early European session and was last seen trading near the daily high, around mid-1.2500s.Some cross-driven strength stemming from a dramatic turnaround in the EUR/GBP cross turned out to be a key factor that extended some support to the GBP/USD pair. Apart from this, the uptick lacked any obvious fundamental catalyst and runs the risk of fizzling out rather quickly amid diminishing odds for any further interest rate hikes by the Bank of England.The flash UK PMIs released on Tuesday showed a sharp deceleration in growth during May and reinforced the BoE's gloomy outlook, warning that Britain is on course to enter a technical recession. This, in turn, suggested that the current rate hike cycle could be nearing a pause, which, along with the UK-EU impasse, should hold back the GBP bulls from placing aggressive bets.On the other hand, the US dollar made a solid comeback and reversed a major part of the overnight slide to a one-month low. This might further contribute to keeping a lid on any meaningful gains for the GBP/USD pair. The fundamental backdrop seems tilted firmly in favour of bearish traders and suggests that any subsequent move up might still be seen as a selling opportunity.There isn't any major market-moving data due for release from the UK, while the US economic docket features Durable Goods Orders. The focus, however, will remain glued to the FOMC monetary policy meeting minutes, due for release later during the US session. Investors will look for cues about the possibility of a jumbo 75 bps rate hike in June, which will play a key role in influencing the near-term USD price dynamics and provide a fresh impetus to the GBP/USD pair.  ",fxstreet
2,2022-05-25,EUR/USD: Rally unlikely to extend towards the 1.08-1.09 area – ING,"EUR/USD broke the 1.07 mark on Tuesday. However, a move to 1.08-1.09 in is not the base case of economists at ING.“Now, it appears most of the positives are in the price, especially considering that markets are already pricing in 100 bps of ECB tightening by year-end, and we think a consolidation looks more likely than an extension of the rally to the 1.08-1.09 region.”“The eurozone calendar doesn’t include market-moving data releases today, but there is a long line of scheduled ECB speakers to keep an eye on: Christine Lagarde and Klaas Knot in Davos, Robert Holtzmann, Pablo Hernández de Cos and Philip Lane elsewhere.” ",fxstreet
2,2022-05-25,Silver Price Analysis: XAG/USD sees a minor countermove after marking a change of trend lower – Credit Suisse,"Silver has completed a large and significant top. However, the precious metal is now seeing a minor short-term countermove, economists at Credit Suisse report.“Silver is seeing a minor countermove after having removed long-term price support at $21.68/42 previously, which we believe completed a large and significant top to mark an important change of trend lower.”“Support is seen at $19.65 initially, then $18.95/40, which we look to hold at first for a consolidation phase.” “Only above the 200-day average, currently at $23.56, would stabilize the precious metal more meaningfully, which is not our base case.” ",fxstreet
2,2022-05-25,"NZD/USD: RBNZ will deliver two more half-point hikes, fueling a return to 0.70 – ING","The Reserve Bank of New Zealand (RBNZ) hiked rates by another 50bp to 2.0% today but delivered a substantial hawkish surprise with its updated rate projections. However, that is a story for the long run, and economists at ING expect NZD/USD to climb towards 0.70 by end-2022“The RBNZ signalled a terminal rate around 4.0% in 2023, following a 50bp hike today.”“The Bank now forecasts the policy rate at 3.25-3.50% by year-end and around 200bp of total tightening by the end of 2023 – therefore signalling a terminal rate around 4.0%. We suspect the rate projections may be too hawkish, but this is a story for the long run: for now, 50bp hikes should keep the NZD on track for a return to 0.70 by year-end.”“The short-term outlook for NZD (and its ability to consolidate above 0.65) remains strictly tied to swings in global risk sentiment and the Chinese economic outlook, which remains a major source of uncertainty.”",fxstreet
2,2022-05-25,"Forex Today: Dollar stays resilient ahead of key US data, FOMC Minutes","Here is what you need to know on Wednesday, May 25:Pressured by the falling US Treasury bond yields, the greenback continued to weaken against its rivals on Tuesday. The risk-averse market environment, however, helped the US Dollar Index limit its losses. The dollar stays resilient against its major rivals early Wednesday ahead of April Durable Goods Orders data from the US. Later in the day, the FOMC will release the minutes of its May policy meeting. The European Central Bank (ECB) will publish the EU Financial Stability Review as well. FOMC May Minutes Preview: Will the Fed have to sell MBS?Escalating geopolitical tensions between China and the US cause investors to stay away from risk-sensitive assets. Chinese state media said on Wednesday that it recently conducted a military exercise around Taiwan as a serious warning to interactions between the US and Taiwan. Meanwhile, Bloomberg reported on Wednesday that the port city of Tianjin, located near Beijing, locked down a district at the center amid a spike in the number of confirmed coronavirus infections.US stock index futures trade flat in the early European session and the benchmark 10-year US Treasury bond yield is unchanged on a daily basis at around 2.75%.During the Asian trading hours, the Reserve Bank of New Zealand (RBNZ) hiked its policy rate by 50 basis points to 2% as expected. Commenting on the policy outlook, RBNZ Governor Adrian Orr said that they were confident households can withstand higher rates and added that they might need to lift the policy rate above the neutral rate, which is estimated to be around 2%-3%. NZD/USD gained traction on the RBNZ's hawkish tone and climbed above 0.6500 for the first time in three weeks.EUR/USD touched a fresh monthly high of 1.0750 on Tuesday after ECB President Christine Lagarde said that rates could move into positive territory by the end of the third quarter. The pair stays on the back foot early Wednesday and trades below 1.0700. ECB President Lagarde will be delivering a speech at the World Economic Forum.GBP/USD snapped a three-day winning streak on Tuesday. The disappointing PMI data from the UK revived fears over a recession in the UK and made it difficult for the British pound to find demand. The pair stays relatively quiet near mid-1.2500s in the European morning.Gold took advantage of falling US T-bond yields and posted daily gains for the fifth straight trading day before going into a consolidation phase near $1,860. Bitcoin continues to move up and down in a horizontal channel near $30,000. Ethereum struggles to find direction and extends its sideways grind slightly below $2,000.",fxstreet
2,2022-05-25,AUD/USD Price Analysis: Bulls have the upper hand above 100-hour SMA/ascending channel confluence,"The AUD/USD pair edged higher on Wednesday and might now be looking to build on the overnight rebound from the vicinity of the mid-0.7000s support zone.The Australian dollar drew support from the Reserve Bank of Australia's hawkish signal that a bigger interest rate hike is still possible in June amid the upside risks to inflation. Adding to this, a modest bounce in the global risk sentiment further benefitted the risk sensitive aussie, though the emergence of some US dollar buying capped gains ahead of the FOMC minutes.From a technical perspective, the recent strong recovery from the YTD low has been along an upward sloping channel, which points to a well-established short-term bullish trend. The lower boundary of the said trend channel coincides with the 100-hour SMA and should act as a pivotal point. This is closely followed by the 23.6% Fibonacci retracement of the 0.6829-0.7128 rally.A convincing break below the latter will be seen as a fresh trigger for bearish traders and prompt aggressive technical selling. The AUD/USD pair might then accelerate the downfall towards the 38.2% Fibo. level, around the 0.7015 region. The bearish trend could further get extended towards the 0.7000 psychological mark en-route the 50% Fibo. level near the 0.6980 area.On the flip side, momentum beyond the weekly high, around the 0.7125 region, has the potential to lift spot prices to the ascending channel resistance, around the 0.7175-0.7180 zone. Some follow-through buying would mark a fresh bullish breakout and pave the way for a move beyond the 0.7200 round figure, towards testing the 200-day SMA, currently around the 0.7260-0.7265 area.  ",fxstreet
2,2022-05-25,USD/CNH: A drop to 6.6300 should not be ruled out – UOB,"USD/CNH remains under pressure and cold extend the decline to 6.6300 in the next weeks, commented FX Strategists at UOB Group Lee Sue Ann and Quek Ser Leang.24-hour view: “Yesterday, we expected USD to ‘trade sideways within a range of 6.6550/6.6950’. Our view for sideway-trading was not wrong even though USD traded within a narrower range than expected (6.6563/6.6910). Further sideway-trading appears likely but in view of the slightly softened underlying tone, USD is likely to trade within a lower range 6.6480/6.6880.”Next 1-3 weeks: “There is not much to add to our update from yesterday (24 May, spot at 6.6685). As highlighted, further USD weakness is not ruled out but deeply oversold shorter-term conditions could lead to a few days of consolidation first. All in, as long as 6.7100 (strong resistance level was at 6.7300 yesterday) is not breached, there is room for USD to weaken further to the next support at 6.6300.”",fxstreet
2,2022-05-25,US Dollar Index breathes some air and approaches 102.00 ahead of FOMC,"The greenback, in terms of the US Dollar Index (DXY), regains some composure and looks to retake the 102.00 region on Wednesday.The index posts decent gains early in the European morning following two consecutive daily retracements, although it keeps the bearish note unchanged after being rejected from 19-year tops around 105.00 earlier in the month.In the meantime, US yields extend the side-lined theme, although with a small and quite relentless decline from tops witnessed earlier in the month.The sharp sell-off in the US dollar seen in the last couple of weeks came on the back of the strong re-emergence of the appetite for the riskier assets, despite persistent hawkish messages from Fed’s rate-setters, almost all of them pointing to a 50 bps hike of the fed Funds Target Range in the next two FOMC events.Later in the NA session, MBA Mortgage Applications are due in the first turn seconded by April’s Durable Goods Orders, all ahead of the key publication of the FOMC Minutes of the May gathering.The dollar manages to regain the smile and bounce off 4-week lows in the sub-102.00 region so far this week.In the meantime, and supporting the buck, appears investors’ expectations of a tighter rate path by the Federal Reserve and its correlation to yields, the current elevated inflation narrative and the solid health of the labour market.On the negatives for the greenback turn up the incipient speculation of a “hard landing” of the US economy as a result of the Fed’s more aggressive normalization.Key events in the US this week: MBA Mortgage Applications, Durable Goods Orders, FOMC Minutes (Wednesday) – Flash Q1 GDP, Initial Claims, Pending Home Sales (Thursday) – Core PCE, Personal Income/Spending, Final Consumer Sentiment (Friday).Eminent issues on the back boiler: Speculation of a “hard landing” of the US economy. Escalating geopolitical effervescence vs. Russia and China. Fed’s more aggressive rate path this year and 2023. US-China trade conflict. Future of Biden’s Build Back Better plan.Now, the index is gaining 0.30% at 102.07 and a break above 105.00 (2022 high May 13) would open the door to 105.63 (high December 11 2002) and finally 106.00 (round level). On the other hand, the next contention emerges at 101.64 (monthly low May 24) followed by 100.96 (55-day SMA) and then 99.81 (weekly low April 21).",fxstreet
2,2022-05-25,ECB’s Panetta: We should normalise our monetary policy gradually,"Commenting on the monetary policy, European Central Bank (ECB) executive board member Fabio Panetta said Wednesday, “we should normalize our monetary policy gradually.”The inflation path is starting from a much higher point but the medium-term inflation outlook is characterized by high uncertainty.We should normalize our monetary policy and choose a mix of instruments that is.Addressing fragmentation risks is central to the normal conduct of monetary policy in the euro area.Normal does not mean neutral.We should avoid the risk of a “normalization tantrum”.Natural rate of interest has declined significantly.Normal does not mean conventional.EUR/USD was last seen trading at 1.06484, down 0.43% on the day, as the US dollar bounces ahead of the Fed Minutes.",fxstreet
2,2022-05-25,Gold Price Forecast: XAUUSD retreats from two-week high amid modest USD strength,"Gold witnessed some selling on Wednesday and snapped a five-day winning streak to over a two-week high, around the $1,870 area set the previous day. The XAUUSD extended its steady intraday descent through the early European session and touched a fresh daily low, near the $1,856 region in the last hour. The US dollar made a solid comeback and reversed a major part of the overnight losses to a one-month low. This, in turn, was seen as a key factor that undermined the dollar-denominated commodity. Apart from this, a goodish recovery in the US equity futures exerted additional downward pressure on the safe-haven precious metal.The downside, however, seems limited, at least for the time being, amid the worsening global economic outlook. Investors remain worried that a more aggressive move by major central banks to constrain inflation could pose challenges to global economic growth. Adding to this, the Russia-Ukraine war and the latest COVID-19 outbreak in China have been fueling recession fears. This, along with the idea that the Fed could pause the rate hike cycle later this year and a softer tone surrounding the US Treasury bond yields, could act as a tailwind for the non-yielding gold. Hence, the focus remains on the FOMC meeting minutes.Given that a 50 bps Fed rate hike move at the next two meetings is fully priced in, market participants will look for clues about the possibility of a jumbo hike in June. This will play a key role in influencing the near-term USD price dynamics and provide a fresh directional impetus to gold. Heading into the key event risk, the US Durable Goods Orders data could drive the greenback later during the early North American session. Apart from this, the US bond yields and the broader risk sentiment could produce short-term trading opportunities.  ",fxstreet
2,2022-05-25,"USD/CNY: Weakness is seen as corrective, rise towards 6.8475 expected – Credit Suisse","USD/CNY is correcting lower from just ahead of 6.8475/94. However, economists at Credit Suisse expect the pair to resume its uptrend in due course.“USD/CNY points toward a temporary correction and we thus expect that further downside is likely to take place in the near-term. However, with key moving averages still rising, we expect support at 6.5791/5440 to hold to keep the risks higher in the medium term and still anticipate a move to 6.8475 in due course.”“A fall below the 50% retracement of the March/May surge at 6.5794/6.5440 would seriously question our medium-term bullish outlook and open the door to the late April low and the 61.8% retracement at 6.5117/6.4967.” ",fxstreet
2,2022-05-25,GBP/USD: Solid ceiling to be found at the 55-DMA at 1.2830 for a move back lower – Credit Suisse,"GBP/USD has seen a sharp recovery. However, the pair is likely to remain capped below its 55-day moving average (DMA) at 1.2830 for a move back lower, economists at Credit Suisse report.“Although we see scope for the consolidation to extend further and potentially reach the 55-DMA at 1.2830, we expect a more solid ceiling to be found here for a move back lower and an eventual resumption of the core downtrend.” “Support is seen at the recent low at 1.2154, with a break below here triggering an eventual move to the 78.6% retracement of the 2020/21 uptrend and May 2020 low at 1.2073/13.” ",fxstreet
2,2022-05-25,NZD/USD Price Analysis: 200-EMA probes RBNZ-inspired gains below 0.6500,"NZD/USD bulls take a breather around the three-week top, paring post-RBNZ gains near the 0.6500 threshold during early Wednesday in Europe.The Kiwi pair jumped towards the monthly high after the Reserve Bank of New Zealand (RBNZ) unveiled a 0.50% rate hike, matching market forecasts.Read: RBNZ’s Orr: Confident households can withstand higher ratesHowever, the 200-EMA around 0.0.6505 seems to restrict the quote’s latest upside amid the overbought RSI conditions.Also acting as an upside filter is the stated channel’s upper line, surrounding 0.6545, as well as the monthly high of 0.6568.Alternatively, pullback moves may aim for the mid-0.6400s ahead of confronting the 0.6410-15 support confluence including the aforementioned channel’s lower line, 100-EMA and 23.6% Fibonacci retracement of the April-May downside.If at all NZD/USD drops below 0.6440, the odds of its south-run towards the monthly low near 0.6215 can’t be ruled out.To sum up, NZD/USD prices remain in the recovery mode but the recent run-up needs consolidation.Trend: Pullback expected  ",fxstreet
2,2022-05-25,USD/JPY risks a drop to 125.60 near term – UOB,"According to FX Strategists at UOB Group Lee Sue Ann and Quek Ser Leang, further downside in USD/JPY could reach the 125.60 region in the next weeks.24-hour view: “The sharp drop in USD to 126.35 and the subsequent bounce from the low came as a surprise (we were expecting sideway-trading). The rapid drop appears to be overdone and USD is unlikely to weaken further. For today, we expect USD to consolidate and trade between 126.40 and 127.40.”Next 1-3 weeks: “Our latest narrative was from Monday (23 May, spot at 127.90) where there is room for USD to retest the 127.00 level. We added, ‘a breach of this level is not ruled out but at this stage but any further decline is expected to face solid support at 126.50’. USD cracked 127.00 yesterday and plummeted to 126.35 before rebounding. While oversold, the decline has room to extend to 126.00, possibly 125.60. Overall, only a break of 127.90 (‘strong resistance’ level was at 128.55 yesterday) would indicate that weakness in USD that started about two weeks ago has run its course.”",fxstreet
2,2022-05-25,EUR/CHF to trade close to the 1.02/1.03 area in the months ahead – Rabobank,"The better tone in the euro has allowed EUR/CHF to move higher in recent sessions. Economists at Rabobank expect the pair to hover around the 1.02/03 region as the European Central Bank (ECB) will be unable to hike rates amid a European oil embargo on Russia.“Under the cover of ECB rate hikes, the SNB may be able to execute a little bout of policy tightening of its own to pull its key rate back towards zero without creating too many waves for the EUR/CHF exchange rate. That said, while currency strength was a problem for the SNB when inflationary pressure was low, it is unlikely to be viewed in the same way in the current environment.” “We think that there will be an EU oil embargo on Russia. This could make a recession unavoidable for the eurozone and make the window of opportunity for ECB rate hikes very limited. In this scenario, safe-haven demand would likely keep EUR/CHF close to the 1.02/1.03 area in the months ahead.”  ",fxstreet
3,2022-05-25,Natural Gas Futures: Still scope for further gains,"Considering advanced prints from CME Group for natural gas futures markets, open interest reversed four consecutive daily pullbacks and went up by just 703 contracts on Tuesday. On the flip side, volume shrank by nearly 40K contracts, offsetting Monday’s build.Prices of natural gas extended the rebound for yet another session on Tuesday amidst a small uptick in open interest, paving the way for another visit to the 2022 high around the $9.00 mark per MMBtu (May 6).",fxstreet
3,2022-05-25,"EUR/NOK to tick down towards 10.10, Norges Bank to turn more hawkish in June – Credit Suisse","EUR/NOK broke year-to-date highs at 10.38 last week. Economists at Credit Suisse look to sell EUR/NOK rallies to 10.40 targeting 10.10 as they see risks of a hawkish tilt from the Norges Bank in June.“We now expect EUR/NOK to trade in a 9.90-10.60 range, as the external backdrop suggest that high volatility can persist.” “Domestically, recent data more conclusively points to rising risks of a hawkish pivot by Norges Bank on 23 June. For this reason, we are tactically bullish on NOK and we would sell EUR/NOK rallies to 10.40 targeting 10.10.” ",fxstreet
3,2022-05-25,China’s SAFE: Foreign outflows amid a weakening yuan 'under control',"Wang Lei, Deputy Director-General, Capital Account Management Department, China’s State Administration of Foreign Exchange (SAFE) calmed nerves, amidst the recent depreciation of the yuan, at a virtual China capital market conference.“Volatility in China's financial markets and foreign investment into the country was ""a natural response"" in a ""complicated context.”“We see that inflow and outflow are quite natural in securities investment. Everything has been well under control and I see this partial adjustment doesn't change the overall balance of the cross-border capital flow(s) in China.""",fxstreet
3,2022-05-25,EUR/USD: 55-DMA at 1.0786 to prevent further upside – Credit Suisse,"EUR/USD has reversed from a major support level at the 2017 low at 1.0350/41. Economists at Credit Suisse look for a deeper corrective recovery to the 55-day moving average (DMA) at 1.0787. “We look for the 55-DMA at 1.0786 to hold to prevent further upside and thereafter, we look for further ranging. Post this phase, we look for an eventual move back to 1.0341 first, with a break below here paving the way to reach parity later on in the year.”“Above 1.0786, resistance is seen at 1.0841 and then at 1.0904/36, which we look to cap to avoid an even lengthier corrective recovery.” ",fxstreet
3,2022-05-25,"UK: Significant fall in the PMIs reduces BoE rate expectations, weighing on sterling – Commerzbank","The British pound came under downside pressure as a result of the UK PMI publications. The latest data has been interpreted as dampening the prospect for further Bank of England (BoE) monetary tightening, therefore, sterling is set to weaken, economists at Commerzbank report.“The PMIs published yesterday recorded a surprise fall in May, in particular the index for the service sector. The positive economic effect of the corona restrictions coming to an end seems to be easing. Instead, the high cost of living is leading to cautious consumer spending.”“In view of yesterday’s data, it can be assumed that the BoE will continue to sound cautious, which is likely to put pressure on sterling.”If the economy continues to provide negative surprises over the coming months the market might further correct its rate expectations to the downside, putting pressure on sterling.”  ",fxstreet
