page,date,title,body,source
7,2022-05-24,AUD/USD is sliding as investors rethink the macro outlook,"At 0.7085, AUD/USD is trading down some 0.31%, sliding from a high of 0.7107 to a low of 0.7056.  The Australian dollar eased on Tuesday as global stocks underperformed while investors remain concerned over China's economy and COVID lockdowns. At the start of the week, traders favoured the pledges of more stimulus from China's government over the prospects of a prolonged lockdown in various regions of the nation that still struggles with the pandemic. ""The government's dynamic zero-COVID policy will remain in place through 2022, preventing a return to normalcy and limiting the effectiveness of new fiscal and monetary stimulus measures,"" warned S&P Global. ""Thus, real GDP growth will likely slow from 8.1% in 2021 to 4.3% in 2022."" ""New geopolitical, financial, or supply-side shocks could tip the world economy into recession.""Meanwhile, with central banks in the picture, the US dollar's appeal has been hit due to other central bankers speaking out and carrying hawkish rhetoric.  The DXY index, which measures a basket of currencies vs. the US dollar printed a fresh one-month low on Tuesday after European Central Bank President Christine Lagarde said eurozone interest rates will likely be in positive territory by the end of the third quarter. This supported the euro in a correction higher and weighed on the greenback. As for the Reserve Bank of Australia, consumer spending seems to have held up well to the Reserve Bank of Australia's (RBA) first hike in interest rates earlier this month. However, some of the data of late may not have met the mark. ''The Wage Price Index (WPI) came in below expectations in the first quarter at a low 0.7% QoQ (0.65%), the same rate as in the fourth quarter 2021,'' analysts at ANZ Bank explained, adding that ''this suggests the RBA is likely to hike the cash rate another 25bp in June, rather than a larger 40 or 50bp hike.''''The wage and employment data hasn’t, in our view, met Governor Lowe’s threshold of there needing to be “a very strong argument” for the RBA to “deviate” from moves of 25bp in coming months.''''Especially when the minutes from the May meeting highlighted that the Board meets monthly, so has the opportunity to review the setting of interest rates again within a relatively short period of time.''Meanwhile, markets are priced for quarter-point rises in the 0.35% cash rate in both June and July, and a half-point hike in August following what is likely to be another alarming inflation report.Looking ahead, the RBA Assistant Governor Luci Ellis is due to speak and could expand on the central bank's own outlook for policy.  ",fxstreet
7,2022-05-24,"Gold Price Forecast: XAU/USD climbs and keeps above the 20-DMA, around $1860s","Gold spot (XAU/USD) records solid gains and stays above the 20-day moving average (DMA), which lies at $1854.50, amidst a dismal market sentiment, falling US Treasury yields, and a weaker US dollar. At $1867.22, XAU/USD eyes to re-test the March 31 swing low-turned-resistance at around $1889.91.Risk-aversion keeps riskier assets under pressure. Global equities are recording losses, while the non-yielding metal has seen an increase in flows towards its safe-haven status, while the greenback keeps tumbling, a tailwind for Gold prices. The US Dollar Index, a gauge of the buck’s value vs. a basket of peers, is falling 0.36%, down at 101.717.Investors’ concerns that the US Federal Reserve would trigger a recession in favor of bringing inflation down weighed on the market mood. Additionally, China’s ongoing coronavirus crisis keeps the global economic outlook cloudy. According to the Global Times, Shanghai will allow convenience stores and drugstores to resume operations with a maximum occupancy of 50% before May 31 and 75% after June 1.In the meantime, US Treasuries keep plunging, led by the 10-year Treasury yield, down 11 bps, sitting at 2.743%.At the time of writing, Atlanta’s Fed President Raphael Bostic hit the wires. Bostic said he supports expeditious rate hikes to neutral but done  “with intention and without recklessness.” Further added that he does not see clear signs of a wage-price spiral.The US economic docket featured the US S&P Global PMIs for May, which illustrated mixed results, with the Services and Composite Indexes missing expectations while the Manufacturing PMI was unchanged. Furthermore, Richmond’s Fed Manufacturing Index plunged to -14 vs. 15 foreseen, adding to the Fed regional manufacturing reports showing deceleration or contraction.XAU/USD remains neutral biased, despite exchanging hands above the 20 and the 200-day moving averages (DMAs), each at $1854.41 and $1839.36, respectively. The four-consecutive day rally continued, but the non-yielding metal will face substantial resistance levels around the 100-DMA and March’s 31 swing lows. If XAU/USD fails to reclaim the previously mentioned levels, Gold would aim south and re-test the 200-DMA.Upwards, the XAU/USD’s first resistance would be the 100-DMA at 1886.84. Break above would immediately expose the March 31 swing low-turned-resistance at 1889.91, followed by the 1900 mark. On the flip side, the XAU/USD’s first support would be the 20-DMA at $1854.41, followed by the 200-DMA at $1839.36, and then the $1800 figure.  ",fxstreet
7,2022-05-24,Fed's Bostic: Fed might need to pause rate increases in September,"Federal Reserve's Raphael Bostic said rate hikes won’t cause a recession and that the central bank can hike rates to deal with overly high inflation without sending the US economy into recession.He repeats that the Fed rates hikes can take some pause arguing that the Fed might need to pause rate increases in September to take stock of how the economy is performing.Will proceed 'with intention, without recklessness'.Monetary policymakers must be mindful of uncertainties, proceed carefully in tightening policy.The bruised US dollar was sold off to a fresh one-month low on Tuesday. Against a basket of its rivals (DXY), the dollar fell to 101.646, its lowest level since April 25. ",fxstreet
7,2022-05-24,USD/JPY drops to one-month lows near 126.30 as US yields fall further,"The USD/JPY ended with days of consolidation with a sharp decline on Tuesday. The pair broke under 127.00 and tumbled to 126.34, the lowest level in a month. It remains near the lows, under pressure amid risk aversion.The decline of USD/JPY gained momentum on the back of a weaker US dollar, lower yields and as stocks in Wall Street turned red. The Dow Jones is falling 0.83% and the Nasdaq drops by 2.78%. The US 10-year yield stands at 2.73%, a four-week low while the 30-year is back under 3%.Economic data from the US came in below expectations (PMIs and New Home Sales) and weighed on the greenback. The DXY is falling 0.37%, trading at 101.70, the lowest in almost a month.Analysts at MUFG Bank, see the USD/JPY pair with a bearish bias, moving in the range 122.00/129.50 during the next weeks.  “The main risk to our bearish outlook for USD/JPY would be if global growth concerns eased in the month ahead. A pick-up in China growth could be one potential trigger. The upward impact on global yields, commodity prices and a potential stabilization for global equity markets should encourage a higher USD/JPY even if the USD weakens more broadly. Yen weakness would be more evident though against high beta commodity currencies.”If the USD/JPY extends the decline, below the 126.30 support line, 126.00 is the next target followed by 125.75 (April 11, 12 high). A recovery now would face an immediate resistance at the 127.00/05 area. Above the next one might be seen at 127.60 and then comes a downtrend line at 128.30.  ",fxstreet
7,2022-05-24,"EUR/USD: Neutral bias, to move in the 1.03/1.11 range – MUFG","A break lower in the EUR/USD pair to new lows remains plausible in a scenario of tighter financial conditions, explain analysts at MUFG Bank. They point out the scale of the sell-off of the dollar does highlight the limits to the bull-run from here and with so much Federal Reserve tightening priced, they still expect the US dollar to weaken more notably later in the year.“We are sticking to our neutral bias for EUR/USD in the month ahead. The ECB’s recent hawkish policy shift has helped to provide some much-needed support for the EUR after it briefly tested and held support from the low in early 2017 at 1.0340. The EUR has since staged a relief rally moving back into the middle of our forecast range. The turnaround for the EUR has been reinforced by hawkish comments from President Lagarde signalling clearly that the ECB plans to speed up the pace of policy tightening in response to upside inflation risks.”“The removal of negative rate policy should provide more support for the EUR going forward given that it has proved effective at helping to keep the EUR weak by encouraging record capital outflows into foreign bond markets while it has been in place. It was more normal for EUR/USD to trade above the 1.2000-level in the decade prior to the introduction of negative rates.”“The EUR’s ability to extend its recent advance much further on the back of the normalization of ECB policy remains constrained by ongoing downside risks from the Ukraine conflict. It appears increasingly likely now that the conflict will prove more prolonged than initially hoped and thereby increases the risk of a longer period of disruption for the euro-zone economy that will both dampen growth and keep inflation higher for longer.”",fxstreet
7,2022-05-24,USD/CAD jumps to six-day highs above 1.2850,"The USD/CAD broke to the upside after moving in a small range for hours and jumped to 1.2872, reaching the highest level since last Thursday. The pair remains near the highs, with the bullish momentum intact.Weaker loonie, USD/CAD rebounds from weekly lowsThe loonie dropped across the board during the American session amid risk aversion. It also lost ground versus AUD and NZD. The Dow Jones is falling 1.40% and the Nasdaq 3.40%. US and Canadian yields are falling, currently at multi-day lows.The slide in equity prices offered some support to the dollar that was affected by weaker than expected US economic data. The S&P Global PMI came in below expectations. The S&P Global Composite dropped in May to the lowest in five months according to preliminary data at 53.8, down from 56 and below the 55.5 of market consensus. New home Sales fell 16.6% in April, worse than expectations. On Wednesday, the FOMC minutes will be released. In Canada, the next important economic report is due on Thursday with retail sales.The USD/CAD is turning to the upside, bouncing from the lowest in two weeks. The pair found support above 1.2760 and now is looking to test the 1.2890 area. A consolidation above 1.2900 should strengthen the outlook for the dollar.On the flip side, 1.2815/20 is the key support. If USD/CAD falls below, the recent low at 1.2764 would be exposed. Below the next support stands at 1.2714 (May 5 low).  ",fxstreet
7,2022-05-24,EUR/USD marches firmly above 1.0700 post-ECB members’ hawkish commentary,"EUR/USD bulls are reclaiming the 1.0700 mark on Tuesday, courtesy of ECB policymakers expressing the need for the central bank to exit from negative rates by the third quarter of 2022, further emphasized on Monday by ECB President Christine Lagarde. At 1.0732, the EUR/USD gains for the second straight day.The greenback remains soft for the second day of the week and is trading below 102.000 the lowest level since April 26, on growing concerns that the Federal Reserve would not achieve a soft landing and trigger a recession. Meanwhile, May’s US S&P Global PMIs showed mixed results, with the Services and Composite Index missing expectations while the Manufacturing PMI came unchanged.Later, Richmond’s Fed Manufacturing Index plunged to -14 vs. 15 foreseen, adding to the list of Fed regional manufacturing reports showing deceleration or contraction. Late at around 16:20, the Fed Chair Jerome Powell would cross the wires.In the meantime, the US 10-year benchmark note follows the buck’s footsteps and is also down 13 bps, sitting at 2.726%.During the Eurozone session, the EU docket witnessed the release of S&P Global PMIs, which showed mixed results. The EU Manufacturing and Services PMI missed expectations, though downtick minimally. The German Manufacturing PMI beat expectations, carrying on the support from Monday’s German IFO readings, which showed the resilience of businesses and consumers.Further ECB speaking crossed the wires on Tuesday. ECB’s President Lagarde said, “I don’t think that we’re in a situation of surging demand at the moment. It’s definitely an inflation that is fueled by the supply side of the economy. In that situation, we have to move in the right direction, obviously, but we don’t have to rush and we don’t have to panic.” In the meantime, ECB’s Francois Villeroy added that “A 50 bp hike is not part of the consensus at this point, I am clear. Interest rate hikes will be gradual.”Albeit Lagarde and Villeroy’s efforts to push back, additional ECB “hawks” crossed wires. ECB’s Holzmann said a 50 bps hike in July would be appropriate. Furthermore, ECB’s Kazakhs added to that list and commented that the central bank should not rule out 50 bps rate rises and look for hikes in July and September, and possibly another in Q4.In the week ahead, the EU docket is packed and will feature German Gfk Consumer Confidence, German GDP, and France’s Consumer Confidence. On the US front, Durable Goods Orders, May’s FOMC Minutes, US GDP Growth Estimates, and the Fed’s favorite gauge of inflation, the Personal Consumption Expenditure (PCE).The EUR/USD remains downward biased, despite the last couple of weeks’ price action, which formed a bottom after dropping from 2021 tops at around 1.2349. Nevertheless, the shared currency is still hovering around the April 2020 lows near 1.0727, which means that a daily close above the previously mentioned would open the door for further gains. Otherwise, the EUR/USD rally to the 1.0720s area would be seen as an opportunity for EUR/USD bears to add to their positions and aim for a re-test of the YTD lows at 1.0348.Upwards, the EUR/USD’s first resistance would be the 50-day moving average (DMA) at 1.0767. Break above would expose the March 7 daily low at 1.0805, followed by the 1.0900 mark. On the flip side, the major’s first support would be 1.0700. A breach of the latter would expose April 2017 daily low at 1.0635, followed by the 20-DMA at 1.0535.  ",fxstreet
7,2022-05-24,"GBP/JPY slumps from above 160 to low 158s, dragged lower as UK/US yields tumble post poor-UK/US PMI data","UK government bond yields had already been on the back foot in the lead up to the start of the US trading session in wake of much weaker than expected UK PMI data for May released earlier in the day which triggered renewed fears about the UK’s increasingly fragile, inflation plagued economy, but that move lower accelerated in tandem with a drop in global yields after disappointing US Service PMI numbers, which triggered fears about a slowdown in the world’s most important/largest economy.UK 10-year yields were last trading lower by more than 10 bps on the day, with similar drops seen in the US and, to a lesser extent owing to hawkish ECB commentary, the Eurozone. As a result, UK (and global)/Japan yields differentials have narrowed significantly on the day, weighing heavily on G10/JPY pairs owing to the yen’s sensitivity to rate differentials.GBP/JPY was last trading close to one-week lows under the 158.50 mark, down about 1.6% or over 250 pips on the day and eyeing a break lower towards monthly lows in the 156.00 area. Technicians will note how the 21-Day Moving Average (at 160.40) has once again proven a solid level of resistance, as has been the case since late April. As global growth fears largely subsume fears about central bank tightening, thus sending yields lower, G10/JPY pairs like GBP/JPY remain at risk of further losses. Traders will likely be targetting a test of the 200DMA in the mid-155.00s in the coming weeks.  ",fxstreet
7,2022-05-24,"ECB's Kazaks: Shouldn't rule out a 50 bps rate hike, sees hikes in July, September, possible one more in Q4","European Central Bank policymaker Martins Kazaks said on Tuesday that the bank should not rule out a 50 bps rate hike, and that he sees possible rate hikes in July, September and potentially one more in Q4, reported Reuters. His remarks come after fellow ECB policymaker Robert Holzmann called for a 50 bps move in July,, ECB's Francois Villeroy de Galhau said a 50 bps rate hike isn't yet consensus at the bank and ECB President Christine Lagarde reiterated that the bank will take rates out of negative territory in Q3. ",fxstreet
7,2022-05-24,"NZD/USD stabilises near 0.6450 pre-RBNZ as markets digest weak NZ Retail Sales, soft US Service PMI data","Softer than expected Q1 New Zealand Retail Sales growth figures have contributed to a weakening of the kiwi on Tuesday, with NZD/USD eroding much of the gains it made on Monday as a result. Worries about global growth as scores of major institutions revised down their growth estimates for the Chinese economy and more US companies warned about a worsening economic environment also weighed. The pair is currently trading near the 0.6450 level, down about 0.3% on the day, after reaching as high as 0.6490 at the start of the week. Just released US Services PMI data for May was worse-than-expected and has helped the kiwi pare some of its intra-day losses versus the buck, with NZD/USD having been as low as the 0.6420s earlier in the day.Back to the New Zealand data; real Retail Sales growth came in at -0.5% QoQ in the first quarter of this year, below expectations for a solid pace of increase. Analysts at Westpac said the data “signals downside risk to our forecasts for a 0.6% rise in March quarter GDP”. “The rise in consumer prices is squeezing households' spending power,” they added, “while the rise in mortgage rates and related debt servicing costs will add to the pressures on discretionary incomes”.Still, the RBNZ is nonetheless expected to press ahead with a 50 bps rate hike during the upcoming Wednesday Asia Pacific session. Kiwi traders will be closely scrutinising the bank’s guidance for future rate hikes and NZD could be choppy as a result. Ahead of the upcoming RBNZ announcement, NZD/USD traders will also have to keep an eye on commentary from Fed Chair Jerome Powell from 16:20 GMT, where he will likely reiterate the bank’s stance that it is ready to lift interest rates above neutral without hesitation if needed to tame inflation.  ",fxstreet
7,2022-05-24,US: New Home Sales slump by 16.6% in April after dropping 10.5% in March,"New Home Sales in the US in April slumped 16.6% MoM, according to the latest data from the US Census Bureau released on Tuesday. That comes after a 10.5% slump in March, reflecting the ongoing impact of the recent sharp rise in mortgage rates. New Homes Sales came in at 591K over the past 12 months to April, well below expectations for 750K and down from March's 709K.  FX markets do not seem to have reacted to the latest US housing figures, concerning for the US economy though they were. Focus instead has seemingly remained on weak US Service PMI data released a few minutes before, which knocked the DXY back to session lows. ",fxstreet
7,2022-05-24,"USD/CHF breaks below 0.9600 mark, hits fresh monthly low amid risk-off/weaker USD","The USD/CHF pair dropped to a nearly one-month low during the early North American session and is now looking to extend the downward trajectory below the 0.9600 round-figure mark.The pair prolonged its recent sharp retracement slide from a two-year peak, around the 1.0065 region touched earlier this month and witnessed some follow-through selling on Tuesday. This marked the second successive day of a downfall - also the fifth in the previous six - and was sponsored by a combination of factors.The worsening global economic outlook continued weighing on investors' sentiment, which was evident from a fresh wave of the risk-aversion trade. This, in turn, boosted demand for the traditional safe-haven Swiss franc and dragged the USD/CHF pair lower amid the emergence of heavy selling around the US dollar.The anti-risk flow was reinforced by a fresh leg down in the US Treasury bond yields. Apart from this, strong pickup in the shared currency - bolstered by hawkish comments by the ECB policymakers - dragged the USD Index to a fresh monthly low. This was seen as another factor that contributed to the USD/CHF pair's decline.On the economic data front, the US PMIs indicated a deceleration of growth in both - the manufacturing and services sector - and did little to provide any respite to the USD bulls. Tuesday's US economic docket also features New Home Sales and Richmond Manufacturing Index, though the focus remains on Fed Chair Jerome Powell's speech.  ",fxstreet
7,2022-05-24,USD/TRY in 2022 highs: Bulls remain well in charge in May,"Further weakness in the Turkish currency lifts USD/TRY to new YTD highs past the 16.00 barrier on Tuesday.USD/TRY advances for the third session in a row and finally manages to leave behind the 16.00 hurdle on Tuesday despite the persistent offered stance in the greenback.The lira, in the meantime, continues to suffer the omnipresent geopolitical tensions stemming from the war in Ukraine and its associated energy crisis, while rising speculation of a global slowdown seems to have already started to weigh on the currency.In addition, inflation concerns appear unabated and were particularly exacerbated after the monthly survey by the Turkish central bank (CBRT) on Monday now sees inflation around 58% by year end.Investors’ attention, in the meantime, slowly shifts to the CBRT’s event on Thursday and whether the bank will finally start hiking rates to tame the rampant inflation.USD/TRY keeps the upside bias well and sound and trades beyond the 16.00 yardstick for the first time since late December 2021.So far, price action in the Turkish currency is expected to gyrate around the performance of energy prices, the broad risk appetite trends, the Fed’s rate path and the developments from the war in Ukraine.Extra risks facing TRY also come from the domestic backyard, as inflation gives no signs of abating, real interest rates remain entrenched in negative figures and the political pressure to keep the CBRT biased towards low interest rates remain omnipresent.Key events in Turkey this week: Economic Confidence Index, CBRT Interest Rate Decision (Thursday).Eminent issues on the back boiler: FX intervention by the CBRT. Progress (or lack of it) of the government’s new scheme oriented to support the lira via protected time deposits. Constant government pressure on the CBRT vs. bank’s credibility/independence. Bouts of geopolitical concerns. Structural reforms. Upcoming Presidential/Parliamentary elections.So far, the pair is gaining 0.80% at 16.0484 and is expected to meet the next hurdle at 16.1533 (2022 high May 24) seconded by 18.2582 (all-time high December 20) and then 19.00 (round level). On the other and, a breach of 14.6836 (monthly low May 4) would expose 14.5458 (monthly low April 12) and finally 14.5136 (weekly low March 29).",fxstreet
7,2022-05-24,"Commodities go back to the 70s, repeating the same stagflation trade – Deutsche Bank","How should investors position for stagflation? Economists at Deutsche Bank can already see similar patterns between how different assets performed in the 1970s and how they have been doing today. Commodities are the only asset class to see relatively consistent gains.“The main takeaway should be that if inflation stays high for many years, then both history and today's high starting valuations suggest it will be very difficult to generate positive real returns in most traditional financial asset classes. Nominal returns will also likely underperform their long-term trend.” “Commodities could be the exception although the run-up in prices in the last few quarters leaves the asset class much more expensive than it was.”“Traditional assets will need inflation to return back towards target in order to get back to long-term positive real returns. If not, then prepare for a decade of real wealth destruction after four decades of huge real wealth accumulation.” ",fxstreet
7,2022-05-24,US: Markit Manufacturing PMI falls to 57.5 in May (flash estimate) versus expected 57.5,"The flash estimate for May of IHS Markit's headline US Manufacturing PMI came in at 57.5, in line with expectations, data released on Tuesday showed. That was a slight decline from 59.2 last month. However, the flash estimate for May of IHS Markit's headline US Services PMI came in at 53.5, below expectations for a reading of 55.2 and below last month's 55.6. That meant that the flash estimate of IHS Markit's US Composite PMI fell to 53.8 in May from 55.6 in April. The US dollar has been under selling pressure in recent trade in wake of the downbeat US Service PMI numbers, which come at a time when recent earnings announcements (from Snap Inc. on Tuesday but also lots of big US retailers last week) have been warning about a worsening consumer environment. The DXY recently fell to fresh session lows under the 101.75 level, and is now down about 0.4% on the day. ",fxstreet
