page,date,title,body,source
4,2022-05-25,"AUD/USD marches towards 0.7120 as DXY eases, the spotlight is on FOMC minutes","The AUD/USD pair is advancing firmly to re-test its weekly high at 0.7127 as risk-on impulse rebounds and safe-haven assets are losing their traction again. The pair has recovered its entire intraday losses and is expected to display more gains in today’s session.The aussie dollar has regained strength after Reserve Bank of Australia Assistant Governor (Economic) Luci Ellis bolstered the expectations of more rate hike announcements by the RBA in its upcoming monetary policy. Mounting price pressures are compelling for a rate hike announcement itself in June. He also added that the tightening policy will reduce the imbalance in the demand-supply mechanism. The housing market is at its capacity, however global supply chain disruptions and advancing material costs are delaying the project completions and dampening profit margins.Going forward, the Australian Bureau of Labor Statistics will report the Retail Sales this week. Investors should brace for some pressure on the economic data as it is expected to tumble to 0.9% against the prior print of 1.6%.Meanwhile, the US dollar index (DXY) has witnessed some offers after failing to surpass the round-level resistance of 102.00. The DXY has continued its vulnerable performance as investors are underpinning the positive market sentiment. In today’s session, the focus will remain on the Federal Open Market Committee (FOMC) minutes, which will dictate the decision-making behind featuring the 50 basis points (bps) interest rate hike decision.   ",fxstreet
4,2022-05-25,USD/INR Price News: Rupee stays depressed around 77.50 on Indian stocks gloom,"USD/INR pares the first daily gains in three around 77.55 as Indian markets open for Wednesday’s trading.The Indian rupee (INR) managed to cheer the US dollar weakness during the last two days but the latest rebound of the greenback joins pessimism surrounding the Indian stocks to weigh on the pair prices.It’s worth noting that the US Dollar Index (DXY) rises 0.21% intraday while bouncing off a four-week low to regain the 102.00 threshold. The DXY rebound could be linked to the risk-negative headlines from China and South Korea, as well as the market’s preparations for the US Durable Goods Orders for April, expected 0.6% versus 1.1% prior, as well as the Federal Open Market Committee (FOMC) Minutes.On the other hand, a Reuters poll mentioned that India's equity markets will mark their first annual decline in seven years in 2022 as higher interest rates and weakening growth prospects reduce the chances of a quick rebound from this year's already sharp drop. The justification for the same said, “Soaring inflation in India and around the world, with frayed supply chains made worse by Russia's invasion of Ukraine, has pushed most central banks to begin raising interest rates, triggering hefty outflows from risky assets.” It should be observed that India’s benchmark equity index BSE Sensex drops 7.0% during 2022.That said, mixed sentiment and USD recovery could keep the USD/INR prices firmer ahead of key US data and Fed Minutes. The upside, however, needs to be backed by firmer US data and the FOMC member’s growing concerns over inflation, which in turn pushes them towards a more than 50 bps rate hike.Unless breaking a 50-pip trading range between 77.35 and 77.85, USD/INR remains less interesting. However, the recent bearish RSI divergence hints that the pair buyers are running out of steam and hence any clear downside break of the 77.35 will be welcomed with zeal.  ",fxstreet
4,2022-05-25,FX option expiries for May 25 NY cut,"FX option expiries for May 25 NY cut at 10:00 Eastern Time, via DTCC, can be found below.- EUR/USD: EUR amounts        - USD/JPY: USD amounts                      - AUD/USD: AUD amounts  - USD/CAD: USD amounts       - EUR/GBP: EUR amounts- USD/CNY: USD amounts",fxstreet
4,2022-05-25,NZD/USD recaptures day’s high at 0.6500 as RBNZ advocates anchoring inflation projections,"The NZD/USD pair is attempting to overstep the psychological resistance of 0.6500 after getting more clarity over the monetary policy amid a press conference by Reserve Bank of New Zealand (RBNZ) Governor Adrian Orr.In the press conference, RBNZ Orr has cleared that the central bank is focused to prevent the aggregate demand in the economy. Apart from that, pausing inflationary pressure is the major focus area. To safeguard the kiwi economy from the adverse impact of galloping inflation, the central bank is welcoming the certainty of recession.In its monetary policy committee (MPC) meeting, RBNZ Governor announced a rate hike by 50 basis points (bps). It is worth noting that the RBNZ has elevated its Official Cash Rate (OCR) by half a percent consecutively. Officially, the RBNZ’s OCR has been increased to 2%.Meanwhile, the US dollar index (DXY) has recovered the majority of its losses recorded on Tuesday. The DXY is attempting to overstep the round-level resistance of 102.00. Market mood has dampened mounting tensions between North Korea and Japan, which is why the DXY has observed some recovery.Also, the market participants are awaiting the release of the Federal Open Market Committee (FOMC) minutes, which are due in the New York session. Investors will keep an eye on the economic indicators which forced Federal Reserve (Fed) policymakers to feature a 50 bps rate hike. In addition to that, the US Durable Goods Orders will remain in focus. The monthly Durable Goods Orders are seen at 0.6% against the prior print of 1.1%.  ",fxstreet
4,2022-05-25,"Gold Price Forecast: XAU/USD sellers eye $1,848 on USD’s rebound ahead of Fed Minutes","Gold Price (XAU/USD) prints the first daily loss in five as the quote drops to the intraday low of around $1,860 during Wednesday’s Asian session. The metal’s latest weakness could be linked to the US dollar’s rebound from a monthly low ahead of the key data/events.That said, the US Dollar Index (DXY) rises 0.21% as it recovered from a four-week low eye to regain the 102.00 threshold. The DXY rebound could be linked to the risk-negative headlines from China and South Korea, as well as the market’s preparations for the US Durable Goods Orders for April, expected 0.6% versus 1.1% prior, as well as the Federal Open Market Committee (FOMC) Minutes.North Korea’s firing of three missiles and Japan’s dislike for the same join the market’s anxiety ahead of today’s Fed Minutes and seem to also weigh on the market’s optimism. On the same line could be the news updating China’s covid lockdowns and their negative impacts on the world’s second-largest economy. “Beijing has continued its quarantine to end its month-old COVID outbreak, while in Shanghai, authorities plan to keep most restrictions in place this month, before a more complete lifting of the two-month-old lockdown from June 1,” said Bloomberg.While portraying the mood, the S&P 500 Futures pare the early-day gains around 3,955, up 0.40% intraday, whereas the US 10-year Treasury yields stay defensive around one-month low, at 2.76% by the press time.On Tuesday, downbeat prints of the US housing data and repeated Fedspeak, in contrast to the hawkish comments from the ECB, exerted downside pressure on the US Treasury yields and the US Dollar.Looking forward, gold prices are likely to bear the burden of the US dollar rebound. However, any more bearish signals from the FOMC Minutes and/or downbeat US data will allow the precious metal to pare recent losses.Gold Price stays pressured inside a weekly bullish channel, recently tracking RSI (14) as it retreats.Given the RSI pullback from the overbought territory, coupled with the failure to cross the 38.2% Fibonacci retracement (Fibo.) of the April 18 to May 16 downturn, XAU/USD is likely to decline further.However, a convergence of the aforementioned channel’s support and the 100-SMA, around $1,848, appears a tough nut to crack for the gold sellers.In a case where gold drops below $1,848, a south-run towards the $1,800 threshold will precede the bear’s intention to refresh the monthly low, around $1,787 by the press time, which can’t be ruled out.On the contrary, the resistance line of the stated channel, at $1,878 by the press time, will test the XAU/USD bulls should they cross the 38.2% Fibo. near $1,867.Even so, a confluence of the 200-SMA and 50% Fibonacci retracement level, close to $1,892, will challenge the metal’s further upside.Trend: Further weakness expected  ",fxstreet
4,2022-05-25,RBNZ’s Orr: Confident households can withstand higher rates,"Reserve Bank of New Zealand (RBNZ) Governor Adrian Orr is speaking at the May post-monetary policy meeting press conference on Wednesday, shedding more light on the central bank’s hawkish rate hike track.Very focused on restraining aggregate demand.Need to anchor inflation expectations.Confident households can withstand higher rates.This is our best foot forward to restrain inflation.Range of estimates for neutral rate is around 2% to 3%, need rates above 3%.Least regret is too do too much too soon on rates.Funding for lending loans has increased to NZ$10.2bn.A recession is not in our central forecasts, but is possible.Without doubt we believe lot more rate work ahead of us.Our projected fall in house prices is still very mild.Will start public stage of our monetary policy remit next week.NZD/USD is keeping its range near 0.6500 on these above comments, adding 0.53% on the day.",fxstreet
4,2022-05-25,RBNZ Press Conference: Governor Adrian Orr’s speech live stream – May 25,"After a hawkish 50 basis point rate hike delivered by the Reserve Bank of New Zealand (RBNZ) at its May monetary policy meeting, Governor Adrian Orr is likely to hold a press conference at 0300 GMT.Orr’s comments will be closely followed for the next push higher in the NZD/USD pair, as he could the central bank’s hawkish outlook on the rate hikes.The RBNZ stepped up its tightening outlook for the coming months after lifting the Official Cash Rate (OCR) by 50 bps to 2% earlier this Wednesday.#LIVE  Watch the Monetary Policy Statement press conference @ 3:00pm  https://t.co/MaDqwlshOd #rbnz #mps #ocr pic.twitter.com/C0vXfiQF8C  ",fxstreet
4,2022-05-25,AUD/NZD nosedives below 1.0940 as RBNZ announces an interest rate hike by 50 bps,"The AUD/NZD pair has been offered strongly by the market participants after the Reserve Bank of New Zealand (RBNZ) announced a rate hike by 50 basis points (bps). The cross has fallen sharply below 1.0940 as the RBNZ has elevated its Official Cash Rate (OCR) to 2%.The interest rate decision announcement has come in line with the market consensus. A jumbo rate hike to contain the inflationary pressures were highly required in the kiwi area. In the first quarter of CY2022, the annual Consumer Price Index (CPI) was recorded at 6.9%, significantly higher than the targeted boundary of 2%. Keeping in mind the elevated price pressures and tight labor market, RBNZ Governor Adrian Orr is deploying its quantitative weapons to trim the impact on the economy.No one could deny the fact that the consecutive OCR hike by 50 bps would do better to rein in the roaring inflation but along with that, it is not early to say that the RBNZ has pressed the recession button in the kiwi zone. A prompt tightening action by the RBNZ is going to absorb liquidity from the market at a much more rapid pace.Meanwhile, the second antipodean is awaiting the release of the Retail Sales later this week. The Australian Bureau of Statistics is expected to report a serious plunge in the economic data. A preliminary estimate for monthly Retail Sales is 0.9% vs. 1.6% reported last month.  ",fxstreet
4,2022-05-25,Japan’s government maintains economic assessment in May,"In its May economic assessment report, the Japanese government kept its overall view of the economy unchanged amid signs of economic optimism.""The economy is showing signs of picking up.”On imports, the government said they were showing weakness.”“Japan raised its view on employment conditions after the jobless rate edged down to a near two-year low of 2.6% in March.”“They also raised their assessment of housing investment, saying it was largely flat due to an improvement in apartment construction.”USD/JPY remains unfazed by the above upbeat report, as it adds 0.09% on the day to trade at 126.91, as of writing.",fxstreet
4,2022-05-25,NZD/JPY Price Analysis: Jumps past 82.00 on RBNZ rate hike,"NZD/JPY posts stellar gains around 82.35 after the Reserve Bank of New Zealand’s (RBNZ) rate hike worth 50 basis points (bps) during the mid-Asian session on Wednesday.Also read: NZD/USD rallies towards 0.6500 as RBNZ announced 50 bps rate hikeIn doing so, the cross-currency pair not only crosses the 50-HMA to renew daily tops but also extends the run-up beyond a two-week-old ascending trend line. That said, firmer RSI and MACD signals also keep NZD/JPY buyers hopeful.It’s worth noting that the latest rally eyes an upward sloping resistance line from May 17, close to the 83.00 threshold.However, any further upside appears difficult as multiple bottoms marked during late April and early May will challenge the NZD/JPY bulls around 83.35-40.Meanwhile, pullback moves remain elusive until staying beyond the immediate support line, near 81.45 by the press time.Following that, the 80.00 psychological magnet and the monthly low of 79.45 will gain the NZD/JPY bear’s attention.Trend: Further upside expected  ",fxstreet
5,2022-05-25,NZD/USD rallies towards 0.6500 as RBNZ announced 50 bps rate hike,"NZD/USD rallies over 60 pips as the RBNZ announces 50 basis points (bps) of a rate hike in early Wednesday. In doing so, the quote not only reverses the early-day losses but also pokes the three-week high marked on Monday.That said, the Reserve Bank of New Zealand (RBNZ) proves right on the market forecasts while announcing an interest rate lift to 2.0%, from 1.5% prior, the third such move in 2022.Read: Breaking: RBNZ hikes OCR to 2% as expected but sees higher future rates to prior outlooks, sending kiwi higherIt should be observed that risk appetite dwindles as negative headlines from China and South Korea join the cautious mood ahead of the key data/events. While portraying the mood, the S&P 500 Futures pare the early-day gains around 3,955, up 0.40% intraday, whereas the US 10-year Treasury yields stay defensive around one-month low, at 2.76% by the press time.That said, North Korea’s firing of three missiles and Japan’s dislike for the same join the market’s anxiety ahead of today’s Fed Minutes and seem to also weigh on the market’s optimism. On the same line could be the news updating China’s covid lockdowns and its negative impacts on the world’s second-largest economy. “Beijing has continued its quarantine to end its month-old COVID outbreak, while in Shanghai, authorities plan to keep most restrictions in place this month, before a more complete lifting of the two-month-old lockdown from June 1,” said Bloomberg.On Tuesday, downbeat prints of the US housing data and repeated Fedspeak, in contrast to the hawkish comments from the ECB, exerted downside pressure on the US Treasury yields and the US Dollar.Having witnessed the initial reaction to the RBNZ moves, NZD/USD pair traders will wait for RBNZ Governor Adrian Orr’s Press Conference for fresh impetus. Should the policymaker hint at successive rate hikes, that too of higher grades, the Kiwi pair may add some gains. Following that, the US Durable Goods Orders for April, expected 0.6% versus 1.1% prior, will precede the Federal Open Market Committee (FOMC) Minutes to direct the NZD/USD moves.NZD/USD needs to defy Tuesday’s pin bar with a clear upside break of 0.6490 to reject the odds favoring a pullback towards the 21-DMA support of 0.6394. However, any further downside will make the Kiwi pair vulnerable to testing the 0.6300 threshold. Meanwhile, the monthly high surrounding 0.6570 stays on the bull’s radar until the quote stays above the 21-DMA.  ",fxstreet
5,2022-05-25,"Breaking: RBNZ hikes OCR to 2% as expected but sees higher future rates to prior outlooks, sending kiwi higher","The Reserve Bank of New Zealand has hiked the Official Cash Rate by 50 bps to 2% and the markets are now on the lookout for the pace of future tightening for which the Monetary Policy Statement, (MPS), will potentially shed some light. ''With fears of a hard landing at the core of what’s eating away at risk sentiment, as we’ve been saying for a while, if the RBNZ can strike the right balance between “we’ve got this” on inflation while signalling that it is cognisant of recession risks (not an easy job) while also preserving optionality, that’d likely be positive for the Kiwi,'' analysts at ANZ Bank saidAll but one of 21 economists in the Reuters poll forecast the Reserve Bank of New Zealand (RBNZ) would hike the official cash rate (OCR) by 50 basis points to 2.00%. One economist expected a 25 basis point hike.Meanwhile, ""a larger and earlier increase in the OCR reduces the risk of inflation becoming persistent, while also providing more policy flexibility ahead in light of the highly uncertain global economic environment,"" the RBNZ said in a statement.The statement is hawkish and this is supporting the kiwi higher as follows:But following the test of the 38.2% Fibo, the decision has sent the kiwi higher to take on the resistance as follows:The RBNZ is signalling higher rates ''to ensure annual inflation returns within its target range over the next two years.''''Interest rate decisions will likely become more difficult over the second half of the year, especially as evidence of cooling demand starts to mount. As such, we anticipate they will return to more normal 25bp hikes as they assess how previous interest rate hikes are transmitting through the economy,'' analysts at ANZ Bank argued.Meanwhile, the outcome leaves the weekly correction intact and the price is on track for a move into the prior swing lows that have a confluence with the 38.2% Fibonacci retracement level of the prior weekly bearish impulse as follows:RBNZ Interest Rate Decision is announced by the Reserve Bank of New Zealand. If the RBNZ is hawkish about the inflationary outlook of the economy and rises the interest rates it is positive, or bullish, for the NZD.",fxstreet
5,2022-05-25,USD/CNH Price Analysis: Retreats inside weekly triangle below 6.6700,"USD/CNH takes a U-turn from the daily top surrounding 6.6720 as 50-HMA tests the recovery moves inside a weekly triangle. Even so, the offshore Chinese yuan (CNH) pair snaps a four-day downtrend while bouncing off a three-week low, up 0.14% intraday near 6.6675 during Wednesday’s Asian session.Given the recent pick-up in the RSI (14), the USD/CNH rebound may extend towards breaking the aforementioned triangle’s resistance, around 6.6760.However, the 100-HMA and 50% Fibonacci retracement (Fibo.) of May 04-13, respectively around 6.7000 and 6.7250, will be strong resistance for the pair to cross afterward.On the contrary, a convergence of the stated triangle’s support line and 78.6% Fibo. highlights 6.6560 as the short-term key support.Should USD/CNH bears manage to conquer the 6.6560, the odds of witnessing the pair’s slump towards the monthly low of 6.6116 can’t be ruled out.Trend: Further recovery expected  ",fxstreet
5,2022-05-25,"S&P 500 Futures print mild gains, US Treasury yields bounce off monthly low ahead of Fed Minutes","Market sentiment dwindles during early Wednesday as headlines from the Asia-Pacific regions test the risk appetite. Also challenging the optimism is the cautious mood ahead of the key data/events. While portraying the mood, the S&P 500 Futures pare the early-day gains around 3,950, up 0.20% intraday, whereas the US 10-year Treasury yields stay defensive around one-month low, at 2.76% by the press time.North Korea’s firing of three missiles and Japan’s dislike for the same join the market’s anxiety ahead of today’s Fed Minutes and seem to also weigh on the market’s optimism.On the same line could be the news updating China’s covid lockdowns and its negative impacts on the world’s second-largest economy. “Beijing has continued its quarantine to end its month-old COVID outbreak, while in Shanghai, authorities plan to keep most restrictions in place this month, before a more complete lifting of the two-month-old lockdown from June 1,” said Bloomberg.On Tuesday, downbeat prints of the US housing data and repeated Fedspeak, in contrast to the hawkish comments from the ECB, exerted downside pressure on the US Treasury yields and the US Dollar. However, the Wall Street benchmarks closed mixed after the corrective pullback during the late hours.Moving on, traders will pay close attention to the Federal Open Market Committee (FOMC) Minutes as a 50 bps rate hike move garners less attention of late. Also important is the US Durable Goods Orders for April, expected 0.6% versus 1.1% prior.Read: FOMC May Minutes Preview: Will the Fed have to sell MBS?In addition to the aforementioned catalysts, risks emanating from the Russia-Ukraine crisis and fears of global economic growth, mainly due to China and inflation woes elsewhere, will also be important for short-term market directions.",fxstreet
5,2022-05-25,USD/CNY fix: 6.6550 (est 6.6543; prev 6.6566),"In recent trade today, the People’s Bank of China (PBOC) set the yuan (CNY) at 6.6550 vs. the estimate of 6.6543 and the previous 6.6566.China maintains strict control of the yuan’s rate on the mainland.The onshore yuan (CNY) differs from the offshore one (CNH) in trading restrictions, this last one is not as tightly controlled.Each morning, the People’s Bank of China (PBOC) sets a so-called daily midpoint fix, based on the yuan’s previous day's closing level and quotations taken from the inter-bank dealer.",fxstreet
5,2022-05-25,USD/JPY leans bearish on a likely slowdown in US growth momentum – Goldman Sachs,"Analysts at Goldman Sachs recommended going short on USD/JPY via options over a six-month timeframe in their latest client note.""We see a variety of paths to a Yen recovery-US economic weakness and/or upward pressure on rates in Japan and limited scope for further sustained depreciation.”“We recommend buying a 6m 115 USD/JPY digital put, at a price of about 9%, to position for a further step-down in US growth momentum over the coming months.”""We see meaningful downside risks to our 12m USD/JPY forecast of 123, but maintain this projection for now in light of our colleagues relatively upbeat modal forecasts for US equities, US rates, and global commodity prices.”",fxstreet
5,2022-05-25,GBP/USD Price Analysis: Sellers attack short-term key support above 1.2500,"GBP/USD takes offers to refresh intraday low around 1.2520, extending the U-turn from the 200-EMA towards breaking a one-week-old support line during Wednesday’s Asian session.Given the cable pair’s inability to cross the 200-EMA, coupled with the bearish MACD signals, the quote is likely to break the immediate support near 1.2520.The same can direct GBP/USD prices towards one-month-old horizontal support around 1.2420-15.However, any further downside past 1.2415, will not hesitate to challenge 1.2260 and the monthly low surrounding 1.2155.Alternatively, the 200-EMA level of 1.2606 restricts the GBP/USD pair’s immediate upside ahead of the monthly peak of 1.2638.Should the pair buyers manage to cross the 1.2638 hurdle, a convergence of a downward sloping trend line from mid-April and 61.8% Fibonacci retracement (Fibo.) of April-May declines, around 1.2770, will be in the spotlight.Trend: Further weakness expected  ",fxstreet
5,2022-05-25,"Gold Price Forecast: XAU/USD consolidates above $1,860, FOMC minutes and US durable Goods eyed","Gold price (XAU/USD) is juggling in a nominal range of $1,860.42-1,869.75 in the Asian session as investors are awaiting the release of the Federal Open Market Committee (FOMC) minutes in the New-York session. The precious metal has displayed a firmer rally from its recent low of $1,786.78, recorded on May 16. A five-day winning streak by the gold prices is advocating the continuation of a bullish momentum which could continue if the asset oversteps Tuesday’s high at $1,869.75.A significant rise in gold prices is backed by vulnerable performance displayed by the US dollar index (DXY). The DXY has tumbled sharply below 102.00 after printing a 19-year high of 105.00 on May 13. Considering the positive market mood and DXY’s price action, further weakness in the asset cannot be ruled out. In spite of that, investors' focus will remain on the release of the FOMC minutes.Facts that hold significant importance in the FOMC minutes are the number of voters behind the advocacy of the 50 basis points (bps) interest rate hike and economic indicators that may describe the US economic condition in a much more explanatory manner. Apart from the FOMC minutes, the US Durable Goods data hold significant importance. The US Census Bureau is expected to report the monthly Durable Goods Orders at 0.6% against the prior print of 1.1%.On an hourly scale, XAU/USD is auctioning in a Rising Channel that advocates gold bulls. The upper boundary of the Rising Channel is placed from May 17 high at $1,835.97 while the lower boundary is plotted from May 16 low at $1,786.78. A golden cross, represented by the 50- and 200-period Exponential Moving Averages (EMAs) has set a bullish bias for the gold prices. The Relative Strength Index (RSI) (14) has shifted into a bullish range of 60.00-80.00, which adds to the upside filters.    ",fxstreet
